{'title': 'Avengers: Endgame', 'year': '2019', 'rated': 'PG-13', 'released': '26 Apr 2019', 'runtime': '181 min', 'genre': 'Action, Adventure, Drama, Sci-Fi', 'director': 'Anthony Russo, Joe Russo', 'writer': 'Christopher Markus (screenplay by), Stephen McFeely (screenplay by), Stan Lee (based on the Marvel comics by), Jack Kirby (based on the Marvel comics by), Joe Simon (Captain America created by), Jack Kirby (Captain America created by), Steve Englehart (Star-Lord created by), Steve Gan (Star-Lord created by), Bill Mantlo (Rocket Raccoon created by), Keith Giffen (Rocket Raccoon created by), Jim Starlin (Thanos,  Gamora & Drax created by), Stan Lee (Groot created by), Larry Lieber (Groot created by), Jack Kirby (Groot created by), Steve Englehart (Mantis created by), Don Heck (Mantis created by)', 'actors': 'Robert Downey Jr., Chris Evans, Mark Ruffalo, Chris Hemsworth', 'plot': "After the devastating events of Avengers: Infinity War (2018), the universe is in ruins. With the help of remaining allies, the Avengers assemble once more in order to reverse Thanos' actions and restore balance to the universe.", 'language': 'English, Japanese, Xhosa', 'country': 'USA', 'awards': 'N/A', 'poster': 'https://m.media-amazon.com/images/M/MV5BMTc5MDE2ODcwNV5BMl5BanBnXkFtZTgwMzI2NzQ2NzM@._V1_SX300.jpg', 'ratings': [{'source': 'Internet Movie Database', 'value': '8.5/10'}, {'source': 'Rotten Tomatoes', 'value': '94%'}, {'source': 'Metacritic', 'value': '78/100'}], 'metascore': '78', 'imdb_rating': '8.5', 'imdb_votes': '589,503', 'imdb_id': 'tt4154796', 'type': 'movie', 'tomato_meter': 'N/A', 'tomato_image': 'N/A', 'tomato_rating': 'N/A', 'tomato_reviews': 'N/A', 'tomato_fresh': 'N/A', 'tomato_rotten': 'N/A', 'tomato_consensus': 'N/A', 'tomato_user_meter': 'N/A', 'tomato_user_rating': 'N/A', 'tomato_user_reviews': 'N/A', 'tomato_url': 'http://www.rottentomatoes.com/m/the_avengers_3_infinity_war_part_2/', 'dvd': '30 Jul 2019', 'box_office': 'N/A', 'production': 'Marvel Studios', 'website': 'N/A', 'response': 'True'}
{'title': 'The Lion King', 'year': '2019', 'rated': 'PG', 'released': '19 Jul 2019', 'runtime': '118 min', 'genre': 'Animation, Adventure, Drama, Family, Musical', 'director': 'Jon Favreau', 'writer': 'Jeff Nathanson (screenplay by), Brenda Chapman (story), Irene Mecchi (characters), Jonathan Roberts (characters), Linda Woolverton (characters)', 'actors': 'Chiwetel Ejiofor, John Oliver, James Earl Jones, John Kani', 'plot': 'After the murder of his father, a young lion prince flees his kingdom only to learn the true meaning of responsibility and bravery.', 'language': 'English', 'country': 'USA', 'awards': 'N/A', 'poster': 'https://m.media-amazon.com/images/M/MV5BMjIwMjE1Nzc4NV5BMl5BanBnXkFtZTgwNDg4OTA1NzM@._V1_SX300.jpg', 'ratings': [{'source': 'Internet Movie Database', 'value': '7.0/10'}, {'source': 'Rotten Tomatoes', 'value': '53%'}, {'source': 'Metacritic', 'value': '55/100'}], 'metascore': '55', 'imdb_rating': '7.0', 'imdb_votes': '125,916', 'imdb_id': 'tt6105098', 'type': 'movie', 'tomato_meter': 'N/A', 'tomato_image': 'N/A', 'tomato_rating': 'N/A', 'tomato_reviews': 'N/A', 'tomato_fresh': 'N/A', 'tomato_rotten': 'N/A', 'tomato_consensus': 'N/A', 'tomato_user_meter': 'N/A', 'tomato_user_rating': 'N/A', 'tomato_user_reviews': 'N/A', 'tomato_url': 'https://www.rottentomatoes.com/m/the_lion_king_2019', 'dvd': '11 Oct 2019', 'box_office': 'N/A', 'production': 'Walt Disney Pictures', 'website': 'N/A', 'response': 'True'}
{'title': 'Toy Story 4', 'year': '2019', 'rated': 'G', 'released': '21 Jun 2019', 'runtime': '100 min', 'genre': 'Animation, Adventure, Comedy, Family, Fantasy', 'director': 'Josh Cooley', 'writer': 'John Lasseter (original story by), Andrew Stanton (original story by), Josh Cooley (original story by), Valerie LaPointe (original story by), Rashida Jones (original story by), Will McCormack (original story by), Martin Hynes (original story by), Stephany Folsom (original story by), Andrew Stanton (screenplay by), Stephany Folsom (screenplay by)', 'actors': 'Tom Hanks, Tim Allen, Annie Potts, Tony Hale', 'plot': 'When a new toy called "Forky" joins Woody and the gang, a road trip alongside old and new friends reveals how big the world can be for a toy.', 'language': 'English', 'country': 'USA', 'awards': 'N/A', 'poster': 'https://m.media-amazon.com/images/M/MV5BMTYzMDM4NzkxOV5BMl5BanBnXkFtZTgwNzM1Mzg2NzM@._V1_SX300.jpg', 'ratings': [{'source': 'Internet Movie Database', 'value': '8.0/10'}, {'source': 'Rotten Tomatoes', 'value': '97%'}, {'source': 'Metacritic', 'value': '84/100'}], 'metascore': '84', 'imdb_rating': '8.0', 'imdb_votes': '121,373', 'imdb_id': 'tt1979376', 'type': 'movie', 'tomato_meter': 'N/A', 'tomato_image': 'N/A', 'tomato_rating': 'N/A', 'tomato_reviews': 'N/A', 'tomato_fresh': 'N/A', 'tomato_rotten': 'N/A', 'tomato_consensus': 'N/A', 'tomato_user_meter': 'N/A', 'tomato_user_rating': 'N/A', 'tomato_user_reviews': 'N/A', 'tomato_url': 'http://www.rottentomatoes.com/m/toy_story_4/', 'dvd': '01 Oct 2019', 'box_office': 'N/A', 'production': 'Disney/Pixar', 'website': 'N/A', 'response': 'True'}
{'title': 'Captain Marvel', 'year': '2019', 'rated': 'PG-13', 'released': '08 Mar 2019', 'runtime': '123 min', 'genre': 'Action, Adventure, Sci-Fi', 'director': 'Anna Boden, Ryan Fleck', 'writer': 'Anna Boden (screenplay by), Ryan Fleck (screenplay by), Geneva Robertson-Dworet (screenplay by), Nicole Perlman (story by), Meg LeFauve (story by), Anna Boden (story by), Ryan Fleck (story by), Geneva Robertson-Dworet (story by)', 'actors': 'Brie Larson, Samuel L. Jackson, Ben Mendelsohn, Jude Law', 'plot': "Carol Danvers becomes one of the universe's most powerful heroes when Earth is caught in the middle of a galactic war between two alien races.", 'language': 'English', 'country': 'USA, Australia', 'awards': 'N/A', 'poster': 'https://m.media-amazon.com/images/M/MV5BMTE0YWFmOTMtYTU2ZS00ZTIxLWE3OTEtYTNiYzBkZjViZThiXkEyXkFqcGdeQXVyODMzMzQ4OTI@._V1_SX300.jpg', 'ratings': [{'source': 'Internet Movie Database', 'value': '7.0/10'}, {'source': 'Rotten Tomatoes', 'value': '78%'}, {'source': 'Metacritic', 'value': '64/100'}], 'metascore': '64', 'imdb_rating': '7.0', 'imdb_votes': '368,679', 'imdb_id': 'tt4154664', 'type': 'movie', 'tomato_meter': 'N/A', 'tomato_image': 'N/A', 'tomato_rating': 'N/A', 'tomato_reviews': 'N/A', 'tomato_fresh': 'N/A', 'tomato_rotten': 'N/A', 'tomato_consensus': 'N/A', 'tomato_user_meter': 'N/A', 'tomato_user_rating': 'N/A', 'tomato_user_reviews': 'N/A', 'tomato_url': 'http://www.rottentomatoes.com/m/captain_marvel/', 'dvd': '11 Jun 2019', 'box_office': 'N/A', 'production': 'Marvel Studios', 'website': 'N/A', 'response': 'True'}
{'title': 'Spider-Man: Far from Home', 'year': '2019', 'rated': 'PG-13', 'released': '02 Jul 2019', 'runtime': '129 min', 'genre': 'Action, Adventure, Sci-Fi', 'director': 'Jon Watts', 'writer': 'Chris McKenna, Erik Sommers, Stan Lee (based on the Marvel comic book by), Steve Ditko (based on the Marvel comic book by)', 'actors': 'Tom Holland, Samuel L. Jackson, Jake Gyllenhaal, Marisa Tomei', 'plot': 'Following the events of Avengers: Endgame (2019), Spider-Man must step up to take on new threats in a world that has changed forever.', 'language': 'Italian, Czech, English', 'country': 'USA', 'awards': 'N/A', 'poster': 'https://m.media-amazon.com/images/M/MV5BMGZlNTY1ZWUtYTMzNC00ZjUyLWE0MjQtMTMxN2E3ODYxMWVmXkEyXkFqcGdeQXVyMDM2NDM2MQ@@._V1_SX300.jpg', 'ratings': [{'source': 'Internet Movie Database', 'value': '7.6/10'}, {'source': 'Rotten Tomatoes', 'value': '90%'}, {'source': 'Metacritic', 'value': '69/100'}], 'metascore': '69', 'imdb_rating': '7.6', 'imdb_votes': '221,516', 'imdb_id': 'tt6320628', 'type': 'movie', 'tomato_meter': 'N/A', 'tomato_image': 'N/A', 'tomato_rating': 'N/A', 'tomato_reviews': 'N/A', 'tomato_fresh': 'N/A', 'tomato_rotten': 'N/A', 'tomato_consensus': 'N/A', 'tomato_user_meter': 'N/A', 'tomato_user_rating': 'N/A', 'tomato_user_reviews': 'N/A', 'tomato_url': 'https://www.rottentomatoes.com/m/spider_man_far_from_home', 'dvd': '17 Sep 2019', 'box_office': 'N/A', 'production': 'Sony Pictures', 'website': 'N/A', 'response': 'True'}
{'title': 'Aladdin', 'year': '2019', 'rated': 'PG', 'released': '24 May 2019', 'runtime': '128 min', 'genre': 'Adventure, Family, Fantasy, Musical, Romance', 'director': 'Guy Ritchie', 'writer': 'John August (screenplay by), Guy Ritchie (screenplay by)', 'actors': 'Will Smith, Mena Massoud, Naomi Scott, Marwan Kenzari', 'plot': 'A kind-hearted street urchin and a power-hungry Grand Vizier vie for a magic lamp that has the power to make their deepest wishes come true.', 'language': 'Arabic, English', 'country': 'USA', 'awards': 'N/A', 'poster': 'https://m.media-amazon.com/images/M/MV5BMjQ2ODIyMjY4MF5BMl5BanBnXkFtZTgwNzY4ODI2NzM@._V1_SX300.jpg', 'ratings': [{'source': 'Internet Movie Database', 'value': '7.1/10'}, {'source': 'Metacritic', 'value': '53/100'}], 'metascore': '53', 'imdb_rating': '7.1', 'imdb_votes': '151,546', 'imdb_id': 'tt6139732', 'type': 'movie', 'tomato_meter': 'N/A', 'tomato_image': 'N/A', 'tomato_rating': 'N/A', 'tomato_reviews': 'N/A', 'tomato_fresh': 'N/A', 'tomato_rotten': 'N/A', 'tomato_consensus': 'N/A', 'tomato_user_meter': 'N/A', 'tomato_user_rating': 'N/A', 'tomato_user_reviews': 'N/A', 'tomato_url': 'N/A', 'dvd': 'N/A', 'box_office': 'N/A', 'production': 'N/A', 'website': 'N/A', 'response': 'True'}
{'title': 'Joker', 'year': '2019', 'rated': 'R', 'released': '04 Oct 2019', 'runtime': '122 min', 'genre': 'Crime, Drama, Thriller', 'director': 'Todd Phillips', 'writer': 'Todd Phillips, Scott Silver, Bob Kane (based on characters created by), Bill Finger (based on characters created by), Jerry Robinson (based on characters created by)', 'actors': 'Joaquin Phoenix, Robert De Niro, Zazie Beetz, Frances Conroy', 'plot': 'In Gotham City, mentally-troubled comedian Arthur Fleck is disregarded and mistreated by society. He then embarks on a downward spiral of revolution and bloody crime. This path brings him face-to-face with his alter-ego: "The Joker".', 'language': 'English', 'country': 'USA, Canada', 'awards': 'N/A', 'poster': 'https://m.media-amazon.com/images/M/MV5BNGVjNWI4ZGUtNzE0MS00YTJmLWE0ZDctN2ZiYTk2YmI3NTYyXkEyXkFqcGdeQXVyMTkxNjUyNQ@@._V1_SX300.jpg', 'ratings': [{'source': 'Internet Movie Database', 'value': '8.9/10'}, {'source': 'Rotten Tomatoes', 'value': '68%'}, {'source': 'Metacritic', 'value': '59/100'}], 'metascore': '59', 'imdb_rating': '8.9', 'imdb_votes': '360,218', 'imdb_id': 'tt7286456', 'type': 'movie', 'tomato_meter': 'N/A', 'tomato_image': 'N/A', 'tomato_rating': 'N/A', 'tomato_reviews': 'N/A', 'tomato_fresh': 'N/A', 'tomato_rotten': 'N/A', 'tomato_consensus': 'N/A', 'tomato_user_meter': 'N/A', 'tomato_user_rating': 'N/A', 'tomato_user_reviews': 'N/A', 'tomato_url': 'https://www.rottentomatoes.com/m/joker_2019', 'dvd': 'N/A', 'box_office': 'N/A', 'production': 'Warner Bros. Pictures', 'website': 'N/A', 'response': 'True'}
{'title': 'It Chapter Two', 'year': '2019', 'rated': 'R', 'released': '06 Sep 2019', 'runtime': '169 min', 'genre': 'Drama, Fantasy, Horror', 'director': 'Andy Muschietti', 'writer': 'Gary Dauberman (screenplay by), Stephen King (based on the novel by)', 'actors': 'Jessica Chastain, James McAvoy, Bill Hader, Isaiah Mustafa', 'plot': 'Twenty-seven years after their first encounter with the terrifying Pennywise, the Losers Club have grown up and moved away, until a devastating phone call brings them back.', 'language': 'English', 'country': 'Canada, USA', 'awards': 'N/A', 'poster': 'https://m.media-amazon.com/images/M/MV5BYTJlNjlkZTktNjEwOS00NzI5LTlkNDAtZmEwZDFmYmM2MjU2XkEyXkFqcGdeQXVyNjg2NjQwMDQ@._V1_SX300.jpg', 'ratings': [{'source': 'Internet Movie Database', 'value': '6.8/10'}, {'source': 'Rotten Tomatoes', 'value': '63%'}, {'source': 'Metacritic', 'value': '58/100'}], 'metascore': '58', 'imdb_rating': '6.8', 'imdb_votes': '106,507', 'imdb_id': 'tt7349950', 'type': 'movie', 'tomato_meter': 'N/A', 'tomato_image': 'N/A', 'tomato_rating': 'N/A', 'tomato_reviews': 'N/A', 'tomato_fresh': 'N/A', 'tomato_rotten': 'N/A', 'tomato_consensus': 'N/A', 'tomato_user_meter': 'N/A', 'tomato_user_rating': 'N/A', 'tomato_user_reviews': 'N/A', 'tomato_url': 'https://www.rottentomatoes.com/m/it_chapter_two', 'dvd': 'N/A', 'box_office': 'N/A', 'production': 'New Line Cinema', 'website': 'N/A', 'response': 'True'}
{'title': 'Us', 'year': '2019', 'rated': 'R', 'released': '22 Mar 2019', 'runtime': '116 min', 'genre': 'Drama, Horror, Mystery, Thriller', 'director': 'Jordan Peele', 'writer': 'Jordan Peele', 'actors': "Lupita Nyong'o, Winston Duke, Elisabeth Moss, Tim Heidecker", 'plot': "A family's serene beach vacation turns to chaos when their doppelgängers appear and begin to terrorize them.", 'language': 'English', 'country': 'USA', 'awards': 'N/A', 'poster': 'https://m.media-amazon.com/images/M/MV5BZTliNWJhM2YtNDc1MC00YTk1LWE2MGYtZmE4M2Y5ODdlNzQzXkEyXkFqcGdeQXVyMzY0MTE3NzU@._V1_SX300.jpg', 'ratings': [{'source': 'Internet Movie Database', 'value': '6.9/10'}, {'source': 'Rotten Tomatoes', 'value': '93%'}, {'source': 'Metacritic', 'value': '81/100'}], 'metascore': '81', 'imdb_rating': '6.9', 'imdb_votes': '157,509', 'imdb_id': 'tt6857112', 'type': 'movie', 'tomato_meter': 'N/A', 'tomato_image': 'N/A', 'tomato_rating': 'N/A', 'tomato_reviews': 'N/A', 'tomato_fresh': 'N/A', 'tomato_rotten': 'N/A', 'tomato_consensus': 'N/A', 'tomato_user_meter': 'N/A', 'tomato_user_rating': 'N/A', 'tomato_user_reviews': 'N/A', 'tomato_url': 'https://www.rottentomatoes.com/m/untitled_jordan_peele_project', 'dvd': '18 Jun 2019', 'box_office': 'N/A', 'production': 'Universal Pictures', 'website': 'N/A', 'response': 'True'}
{'title': 'Fast & Furious Presents: Hobbs & Shaw', 'year': '2019', 'rated': 'PG-13', 'released': '02 Aug 2019', 'runtime': '137 min', 'genre': 'Action, Adventure', 'director': 'David Leitch', 'writer': 'Chris Morgan (screenplay by), Drew Pearce (screenplay by), Chris Morgan (story by), Gary Scott Thompson (based on characters created by)', 'actors': 'Dwayne Johnson, Jason Statham, Idris Elba, Vanessa Kirby', 'plot': 'Lawman Luke Hobbs and outcast Deckard Shaw form an unlikely alliance when a cyber-genetically enhanced villain threatens the future of humanity.', 'language': 'English, Samoan, Russian', 'country': 'USA', 'awards': 'N/A', 'poster': 'https://m.media-amazon.com/images/M/MV5BOTIzYmUyMmEtMWQzNC00YzExLTk3MzYtZTUzYjMyMmRiYzIwXkEyXkFqcGdeQXVyMDM2NDM2MQ@@._V1_SX300.jpg', 'ratings': [{'source': 'Internet Movie Database', 'value': '6.6/10'}, {'source': 'Rotten Tomatoes', 'value': '67%'}, {'source': 'Metacritic', 'value': '60/100'}], 'metascore': '60', 'imdb_rating': '6.6', 'imdb_votes': '97,905', 'imdb_id': 'tt6806448', 'type': 'movie', 'tomato_meter': 'N/A', 'tomato_image': 'N/A', 'tomato_rating': 'N/A', 'tomato_reviews': 'N/A', 'tomato_fresh': 'N/A', 'tomato_rotten': 'N/A', 'tomato_consensus': 'N/A', 'tomato_user_meter': 'N/A', 'tomato_user_rating': 'N/A', 'tomato_user_reviews': 'N/A', 'tomato_url': 'https://www.rottentomatoes.com/m/hobbs_and_shaw', 'dvd': '15 Oct 2019', 'box_office': 'N/A', 'production': 'Universal Pictures', 'website': 'N/A', 'response': 'True'}
{'title': 'John Wick: Chapter 3 - Parabellum', 'year': '2019', 'rated': 'R', 'released': '17 May 2019', 'runtime': '131 min', 'genre': 'Action, Crime, Thriller', 'director': 'Chad Stahelski', 'writer': 'Derek Kolstad (screenplay by), Shay Hatten (screenplay by), Chris Collins (screenplay by), Marc Abrams (screenplay by), Derek Kolstad (story by), Derek Kolstad (based on characters created by)', 'actors': 'Keanu Reeves, Halle Berry, Ian McShane, Laurence Fishburne', 'plot': "John Wick is on the run after killing a member of the international assassin's guild, and with a $14 million price tag on his head, he is the target of hit men and women everywhere.", 'language': 'Mandarin, Latin, English, Russian, Japanese, Italian, Arabic, Indonesian', 'country': 'USA', 'awards': 'N/A', 'poster': 'https://m.media-amazon.com/images/M/MV5BMDg2YzI0ODctYjliMy00NTU0LTkxODYtYTNkNjQwMzVmOTcxXkEyXkFqcGdeQXVyNjg2NjQwMDQ@._V1_SX300.jpg', 'ratings': [{'source': 'Internet Movie Database', 'value': '7.6/10'}, {'source': 'Rotten Tomatoes', 'value': '90%'}, {'source': 'Metacritic', 'value': '73/100'}], 'metascore': '73', 'imdb_rating': '7.6', 'imdb_votes': '186,360', 'imdb_id': 'tt6146586', 'type': 'movie', 'tomato_meter': 'N/A', 'tomato_image': 'N/A', 'tomato_rating': 'N/A', 'tomato_reviews': 'N/A', 'tomato_fresh': 'N/A', 'tomato_rotten': 'N/A', 'tomato_consensus': 'N/A', 'tomato_user_meter': 'N/A', 'tomato_user_rating': 'N/A', 'tomato_user_reviews': 'N/A', 'tomato_url': 'https://www.rottentomatoes.com/m/john_wick_chapter_3', 'dvd': '23 Aug 2019', 'box_office': 'N/A', 'production': 'Lionsgate', 'website': 'N/A', 'response': 'True'}
{'title': 'How to Train Your Dragon: The Hidden World', 'year': '2019', 'rated': 'PG', 'released': '22 Feb 2019', 'runtime': '104 min', 'genre': 'Animation, Action, Adventure, Family, Fantasy', 'director': 'Dean DeBlois', 'writer': 'Dean DeBlois, Cressida Cowell (based upon the "How to Train Your Dragon" book series by)', 'actors': 'Jay Baruchel, America Ferrera, F. Murray Abraham, Cate Blanchett', 'plot': 'When Hiccup discovers Toothless isn\'t the only Night Fury, he must seek "The Hidden World", a secret Dragon Utopia before a hired tyrant named Grimmel finds it first.', 'language': 'English', 'country': 'USA, Japan', 'awards': 'N/A', 'poster': 'https://m.media-amazon.com/images/M/MV5BMjIwMDIwNjAyOF5BMl5BanBnXkFtZTgwNDE1MDc2NTM@._V1_SX300.jpg', 'ratings': [{'source': 'Internet Movie Database', 'value': '7.5/10'}, {'source': 'Rotten Tomatoes', 'value': '91%'}, {'source': 'Metacritic', 'value': '71/100'}], 'metascore': '71', 'imdb_rating': '7.5', 'imdb_votes': '77,834', 'imdb_id': 'tt2386490', 'type': 'movie', 'tomato_meter': 'N/A', 'tomato_image': 'N/A', 'tomato_rating': 'N/A', 'tomato_reviews': 'N/A', 'tomato_fresh': 'N/A', 'tomato_rotten': 'N/A', 'tomato_consensus': 'N/A', 'tomato_user_meter': 'N/A', 'tomato_user_rating': 'N/A', 'tomato_user_reviews': 'N/A', 'tomato_url': 'http://www.rottentomatoes.com/m/how_to_train_your_dragon_3/', 'dvd': '21 May 2019', 'box_office': 'N/A', 'production': 'Universal Pictures', 'website': 'N/A', 'response': 'True'}
{'title': 'The Secret Life of Pets 2', 'year': '2019', 'rated': 'PG', 'released': '07 Jun 2019', 'runtime': '86 min', 'genre': 'Animation, Adventure, Comedy, Family', 'director': 'Chris Renaud, Jonathan del Val(co-director)', 'writer': 'Brian Lynch', 'actors': 'Patton Oswalt, Kevin Hart, Harrison Ford, Eric Stonestreet', 'plot': 'Continuing the story of Max and his pet friends, following their secret lives after their owners leave them for work or school each day.', 'language': 'English', 'country': 'USA, France, Japan', 'awards': 'N/A', 'poster': 'https://m.media-amazon.com/images/M/MV5BMzdlMWQzZmItMDA5Ny00MGFjLTk0MDAtYjgzMmMyNTEwMzdhXkEyXkFqcGdeQXVyODQzNTE3ODc@._V1_SX300.jpg', 'ratings': [{'source': 'Internet Movie Database', 'value': '6.5/10'}, {'source': 'Rotten Tomatoes', 'value': '59%'}, {'source': 'Metacritic', 'value': '55/100'}], 'metascore': '55', 'imdb_rating': '6.5', 'imdb_votes': '28,497', 'imdb_id': 'tt5113040', 'type': 'movie', 'tomato_meter': 'N/A', 'tomato_image': 'N/A', 'tomato_rating': 'N/A', 'tomato_reviews': 'N/A', 'tomato_fresh': 'N/A', 'tomato_rotten': 'N/A', 'tomato_consensus': 'N/A', 'tomato_user_meter': 'N/A', 'tomato_user_rating': 'N/A', 'tomato_user_reviews': 'N/A', 'tomato_url': 'http://www.rottentomatoes.com/m/the_secret_life_of_pets_2', 'dvd': '13 Aug 2019', 'box_office': 'N/A', 'production': 'Universal Pictures', 'website': 'N/A', 'response': 'True'}
{'title': 'Pokémon Detective Pikachu', 'year': '2019', 'rated': 'PG', 'released': '10 May 2019', 'runtime': '104 min', 'genre': 'Action, Adventure, Comedy, Family, Mystery, Sci-Fi', 'director': 'Rob Letterman', 'writer': 'Dan Hernandez (screenplay by), Benji Samit (screenplay by), Rob Letterman (screenplay by), Derek Connolly (screenplay by), Dan Hernandez (story by), Benji Samit (story by), Nicole Perlman (story by), Satoshi Tajiri (based on "Pokémon" created by), Ken Sugimori (based on "Pokémon" created by), Junichi Masuda (based on "Pokémon" created by), Atsuko Nishida (characters), Tomokazu Ohara (original story), Haruka Utsui (original story)', 'actors': 'Ryan Reynolds, Justice Smith, Kathryn Newton, Bill Nighy', 'plot': 'In a world where people collect Pokémon to do battle, a boy comes across an intelligent talking Pikachu who seeks to be a detective.', 'language': 'English', 'country': 'USA, Japan, UK, Canada', 'awards': 'N/A', 'poster': 'https://m.media-amazon.com/images/M/MV5BNDU4Mzc3NzE5NV5BMl5BanBnXkFtZTgwMzE1NzI1NzM@._V1_SX300.jpg', 'ratings': [{'source': 'Internet Movie Database', 'value': '6.7/10'}, {'source': 'Rotten Tomatoes', 'value': '68%'}, {'source': 'Metacritic', 'value': '53/100'}], 'metascore': '53', 'imdb_rating': '6.7', 'imdb_votes': '102,209', 'imdb_id': 'tt5884052', 'type': 'movie', 'tomato_meter': 'N/A', 'tomato_image': 'N/A', 'tomato_rating': 'N/A', 'tomato_reviews': 'N/A', 'tomato_fresh': 'N/A', 'tomato_rotten': 'N/A', 'tomato_consensus': 'N/A', 'tomato_user_meter': 'N/A', 'tomato_user_rating': 'N/A', 'tomato_user_reviews': 'N/A', 'tomato_url': 'https://www.rottentomatoes.com/m/detective_pikachu', 'dvd': '23 Jul 2019', 'box_office': 'N/A', 'production': 'Warner Bros. Pictures', 'website': 'N/A', 'response': 'True'}
{'title': 'Shazam!', 'year': '2019', 'rated': 'PG-13', 'released': '05 Apr 2019', 'runtime': '132 min', 'genre': 'Action, Adventure, Comedy, Fantasy', 'director': 'David F. Sandberg', 'writer': 'Henry Gayden (screenplay by), Henry Gayden (story by), Darren Lemke (story by), Bill Parker (Shazam created by), C.C. Beck (Shazam created by)', 'actors': 'Zachary Levi, Mark Strong, Asher Angel, Jack Dylan Grazer', 'plot': "We all have a superhero inside us, it just takes a bit of magic to bring it out. In Billy Batson's case, by shouting out one word - SHAZAM - this streetwise fourteen-year-old foster kid can turn into the grown-up superhero Shazam.", 'language': 'English, Spanish', 'country': 'USA, Canada', 'awards': 'N/A', 'poster': 'https://m.media-amazon.com/images/M/MV5BYTE0Yjc1NzUtMjFjMC00Y2I3LTg3NGYtNGRlMGJhYThjMTJmXkEyXkFqcGdeQXVyNTI4MzE4MDU@._V1_SX300.jpg', 'ratings': [{'source': 'Internet Movie Database', 'value': '7.1/10'}, {'source': 'Rotten Tomatoes', 'value': '90%'}, {'source': 'Metacritic', 'value': '70/100'}], 'metascore': '70', 'imdb_rating': '7.1', 'imdb_votes': '185,711', 'imdb_id': 'tt0448115', 'type': 'movie', 'tomato_meter': 'N/A', 'tomato_image': 'N/A', 'tomato_rating': 'N/A', 'tomato_reviews': 'N/A', 'tomato_fresh': 'N/A', 'tomato_rotten': 'N/A', 'tomato_consensus': 'N/A', 'tomato_user_meter': 'N/A', 'tomato_user_rating': 'N/A', 'tomato_user_reviews': 'N/A', 'tomato_url': 'http://www.rottentomatoes.com/m/shazam/', 'dvd': '02 Jul 2019', 'box_office': 'N/A', 'production': 'New Line Cinema', 'website': 'N/A', 'response': 'True'}
{'title': 'Once Upon a Time in Hollywood', 'year': '2019', 'rated': 'R', 'released': '26 Jul 2019', 'runtime': '161 min', 'genre': 'Comedy, Drama', 'director': 'Quentin Tarantino', 'writer': 'Quentin Tarantino', 'actors': 'Leonardo DiCaprio, Brad Pitt, Margot Robbie, Emile Hirsch', 'plot': "A faded television actor and his stunt double strive to achieve fame and success in the film industry during the final years of Hollywood's Golden Age in 1969 Los Angeles.", 'language': 'English, Italian, Spanish', 'country': 'USA, UK, China', 'awards': 'N/A', 'poster': 'https://m.media-amazon.com/images/M/MV5BOTg4ZTNkZmUtMzNlZi00YmFjLTk1MmUtNWQwNTM0YjcyNTNkXkEyXkFqcGdeQXVyNjg2NjQwMDQ@._V1_SX300.jpg', 'ratings': [{'source': 'Internet Movie Database', 'value': '8.0/10'}, {'source': 'Rotten Tomatoes', 'value': '85%'}, {'source': 'Metacritic', 'value': '83/100'}], 'metascore': '83', 'imdb_rating': '8.0', 'imdb_votes': '221,685', 'imdb_id': 'tt7131622', 'type': 'movie', 'tomato_meter': 'N/A', 'tomato_image': 'N/A', 'tomato_rating': 'N/A', 'tomato_reviews': 'N/A', 'tomato_fresh': 'N/A', 'tomato_rotten': 'N/A', 'tomato_consensus': 'N/A', 'tomato_user_meter': 'N/A', 'tomato_user_rating': 'N/A', 'tomato_user_reviews': 'N/A', 'tomato_url': 'https://www.rottentomatoes.com/m/once_upon_a_time_in_hollywood', 'dvd': 'N/A', 'box_office': 'N/A', 'production': 'Columbia Pictures', 'website': 'N/A', 'response': 'True'}
{'title': 'Dumbo', 'year': '2019', 'rated': 'PG', 'released': '29 Mar 2019', 'runtime': '112 min', 'genre': 'Adventure, Family, Fantasy', 'director': 'Tim Burton', 'writer': 'Ehren Kruger (screenplay by), Helen Aberson (novel), Harold Pearl (novel)', 'actors': 'Colin Farrell, Michael Keaton, Danny DeVito, Eva Green', 'plot': 'A young elephant, whose oversized ears enable him to fly, helps save a struggling circus, but when the circus plans a new venture, Dumbo and his friends discover dark secrets beneath its shiny veneer.', 'language': 'English, French', 'country': 'USA, UK, Australia, Canada', 'awards': 'N/A', 'poster': 'https://m.media-amazon.com/images/M/MV5BNjMxMDE0MDI1Ml5BMl5BanBnXkFtZTgwMzExNTU3NjM@._V1_SX300.jpg', 'ratings': [{'source': 'Internet Movie Database', 'value': '6.3/10'}, {'source': 'Rotten Tomatoes', 'value': '47%'}, {'source': 'Metacritic', 'value': '51/100'}], 'metascore': '51', 'imdb_rating': '6.3', 'imdb_votes': '48,114', 'imdb_id': 'tt3861390', 'type': 'movie', 'tomato_meter': 'N/A', 'tomato_image': 'N/A', 'tomato_rating': 'N/A', 'tomato_reviews': 'N/A', 'tomato_fresh': 'N/A', 'tomato_rotten': 'N/A', 'tomato_consensus': 'N/A', 'tomato_user_meter': 'N/A', 'tomato_user_rating': 'N/A', 'tomato_user_reviews': 'N/A', 'tomato_url': 'https://www.rottentomatoes.com/m/dumbo_2019', 'dvd': '25 Jun 2019', 'box_office': 'N/A', 'production': 'Walt Disney Pictures', 'website': 'N/A', 'response': 'True'}
