{'title': 'Dora and the Lost City of Gold', 'year': '2019', 'rated': 'PG', 'released': '09 Aug 2019', 'runtime': '102 min', 'genre': 'Adventure, Family', 'director': 'James Bobin', 'writer': 'Chris Gifford (based on the series created by), Matthew Robinson (screenplay by), Nicholas Stoller (screenplay by), Nicholas Stoller (script), Valerie Walsh (based on the series created by), Eric Weiner (based on the series created by), Tom Wheeler (story by)', 'actors': 'Benicio Del Toro, Madelyn Miranda, Dee Bradley Baker, Malachi Barton', 'plot': 'Dora, a teenage explorer, leads her friends on an adventure to save her parents and solve the mystery behind a lost city of gold.', 'language': 'English, Spanish', 'country': 'USA, Mexico, Australia', 'awards': 'N/A', 'poster': 'https://m.media-amazon.com/images/M/MV5BOTVhMzYxNjgtYzYwOC00MGIwLWJmZGEtMjgwMzgxMWUwNmRhXkEyXkFqcGdeQXVyNjg2NjQwMDQ@._V1_SX300.jpg', 'ratings': [{'source': 'Internet Movie Database', 'value': '6.1/10'}, {'source': 'Rotten Tomatoes', 'value': '84%'}, {'source': 'Metacritic', 'value': '63/100'}], 'metascore': '63', 'imdb_rating': '6.1', 'imdb_votes': '5,933', 'imdb_id': 'tt7547410', 'type': 'movie', 'tomato_meter': 'N/A', 'tomato_image': 'N/A', 'tomato_rating': 'N/A', 'tomato_reviews': 'N/A', 'tomato_fresh': 'N/A', 'tomato_rotten': 'N/A', 'tomato_consensus': 'N/A', 'tomato_user_meter': 'N/A', 'tomato_user_rating': 'N/A', 'tomato_user_reviews': 'N/A', 'tomato_url': 'https://www.rottentomatoes.com/m/dora_the_explorer_2019', 'dvd': 'N/A', 'box_office': 'N/A', 'production': 'Paramount Pictures', 'website': 'N/A', 'response': 'True'}
{'title': 'Escape Room', 'year': '2019', 'rated': 'PG-13', 'released': '04 Jan 2019', 'runtime': '99 min', 'genre': 'Action, Adventure, Horror, Mystery, Thriller', 'director': 'Adam Robitel', 'writer': 'Bragi F. Schut (screenplay by), Maria Melnik (screenplay by), Bragi F. Schut (story by)', 'actors': 'Taylor Russell, Logan Miller, Jay Ellis, Tyler Labine', 'plot': 'Six strangers find themselves in a maze of deadly mystery rooms and must use their wits to survive.', 'language': 'English', 'country': 'USA, South Africa', 'awards': 'N/A', 'poster': 'https://m.media-amazon.com/images/M/MV5BMjQ2NDMwMTY3MF5BMl5BanBnXkFtZTgwNDg5OTc1NjM@._V1_SX300.jpg', 'ratings': [{'source': 'Internet Movie Database', 'value': '6.3/10'}, {'source': 'Rotten Tomatoes', 'value': '50%'}, {'source': 'Metacritic', 'value': '48/100'}], 'metascore': '48', 'imdb_rating': '6.3', 'imdb_votes': '58,913', 'imdb_id': 'tt5886046', 'type': 'movie', 'tomato_meter': 'N/A', 'tomato_image': 'N/A', 'tomato_rating': 'N/A', 'tomato_reviews': 'N/A', 'tomato_fresh': 'N/A', 'tomato_rotten': 'N/A', 'tomato_consensus': 'N/A', 'tomato_user_meter': 'N/A', 'tomato_user_rating': 'N/A', 'tomato_user_reviews': 'N/A', 'tomato_url': 'https://www.rottentomatoes.com/m/escape_room_2019', 'dvd': '23 Apr 2019', 'box_office': 'N/A', 'production': 'Columbia Pictures', 'website': 'N/A', 'response': 'True'}
{'title': 'Abominable', 'year': '2019', 'rated': 'PG', 'released': '27 Sep 2019', 'runtime': '97 min', 'genre': 'Animation, Adventure, Comedy, Family, Fantasy', 'director': 'Jill Culton, Todd Wilderman(co-director)', 'writer': 'Jill Culton', 'actors': 'Chloe Bennet, Albert Tsai, Tenzing Norgay Trainor, Joseph Izzo', 'plot': 'Three teenagers must help a Yeti return to his family while avoiding a wealthy man and a zoologist who want it for their own needs.', 'language': 'English', 'country': 'China, USA', 'awards': 'N/A', 'poster': 'https://m.media-amazon.com/images/M/MV5BMTYzY2U0NjctNDJkNS00MmE3LWFiZGQtZjllZTIzYTQ4ODJkXkEyXkFqcGdeQXVyMDM2NDM2MQ@@._V1_SX300.jpg', 'ratings': [{'source': 'Internet Movie Database', 'value': '7.1/10'}, {'source': 'Rotten Tomatoes', 'value': '83%'}, {'source': 'Metacritic', 'value': '61/100'}], 'metascore': '61', 'imdb_rating': '7.1', 'imdb_votes': '6,339', 'imdb_id': 'tt6324278', 'type': 'movie', 'tomato_meter': 'N/A', 'tomato_image': 'N/A', 'tomato_rating': 'N/A', 'tomato_reviews': 'N/A', 'tomato_fresh': 'N/A', 'tomato_rotten': 'N/A', 'tomato_consensus': 'N/A', 'tomato_user_meter': 'N/A', 'tomato_user_rating': 'N/A', 'tomato_user_reviews': 'N/A', 'tomato_url': 'https://www.rottentomatoes.com/m/everest_2019', 'dvd': 'N/A', 'box_office': 'N/A', 'production': 'Universal Pictures', 'website': 'N/A', 'response': 'True'}
{'title': 'The Curse of La Llorona', 'year': '2019', 'rated': 'R', 'released': '19 Apr 2019', 'runtime': '93 min', 'genre': 'Horror, Mystery, Thriller', 'director': 'Michael Chaves', 'writer': 'Mikki Daughtry, Tobias Iaconis', 'actors': 'Linda Cardellini, Roman Christou, Jaynee-Lynne Kinchen, Raymond Cruz', 'plot': 'Ignoring the eerie warning of a troubled mother suspected of child endangerment, a social worker and her own small kids are soon drawn into a frightening supernatural realm.', 'language': 'English, Spanish', 'country': 'USA', 'awards': 'N/A', 'poster': 'https://m.media-amazon.com/images/M/MV5BNjU4NjU4ZDktOTg2Ny00MWI2LThiMTAtMGFkZGE1MWI5MzhjXkEyXkFqcGdeQXVyODQxMTI4MjM@._V1_SX300.jpg', 'ratings': [{'source': 'Internet Movie Database', 'value': '5.4/10'}, {'source': 'Rotten Tomatoes', 'value': '29%'}, {'source': 'Metacritic', 'value': '41/100'}], 'metascore': '41', 'imdb_rating': '5.4', 'imdb_votes': '25,749', 'imdb_id': 'tt4913966', 'type': 'movie', 'tomato_meter': 'N/A', 'tomato_image': 'N/A', 'tomato_rating': 'N/A', 'tomato_reviews': 'N/A', 'tomato_fresh': 'N/A', 'tomato_rotten': 'N/A', 'tomato_consensus': 'N/A', 'tomato_user_meter': 'N/A', 'tomato_user_rating': 'N/A', 'tomato_user_reviews': 'N/A', 'tomato_url': 'https://www.rottentomatoes.com/m/the_curse_of_la_llorona_2019', 'dvd': '16 Jul 2019', 'box_office': 'N/A', 'production': 'New Line Cinema', 'website': 'N/A', 'response': 'True'}
{'title': 'Pet Sematary', 'year': '1989', 'rated': 'R', 'released': '21 Apr 1989', 'runtime': '103 min', 'genre': 'Horror, Thriller', 'director': 'Mary Lambert', 'writer': 'Stephen King (novel), Stephen King (screenplay)', 'actors': 'Dale Midkiff, Fred Gwynne, Denise Crosby, Brad Greenquist', 'plot': 'After tragedy strikes, a grieving father discovers an ancient burial ground behind his home with the power to raise the dead.', 'language': 'English', 'country': 'USA', 'awards': '1 win & 5 nominations.', 'poster': 'https://m.media-amazon.com/images/M/MV5BYjBlNTBhYWQtMzg5Yi00NDA2LWJmMjYtZmM0ODhiYzkwYmY5XkEyXkFqcGdeQXVyMTQxNzMzNDI@._V1_SX300.jpg', 'ratings': [{'source': 'Internet Movie Database', 'value': '6.6/10'}, {'source': 'Rotten Tomatoes', 'value': '50%'}, {'source': 'Metacritic', 'value': '38/100'}], 'metascore': '38', 'imdb_rating': '6.6', 'imdb_votes': '87,757', 'imdb_id': 'tt0098084', 'type': 'movie', 'tomato_meter': 'N/A', 'tomato_image': 'N/A', 'tomato_rating': 'N/A', 'tomato_reviews': 'N/A', 'tomato_fresh': 'N/A', 'tomato_rotten': 'N/A', 'tomato_consensus': 'N/A', 'tomato_user_meter': 'N/A', 'tomato_user_rating': 'N/A', 'tomato_user_reviews': 'N/A', 'tomato_url': 'http://www.rottentomatoes.com/m/pet_sematary/', 'dvd': '19 Sep 2000', 'box_office': 'N/A', 'production': 'Paramount Home Video', 'website': 'N/A', 'response': 'True'}
{'title': 'What Men Want', 'year': '2019', 'rated': 'R', 'released': '08 Feb 2019', 'runtime': '117 min', 'genre': 'Comedy, Fantasy, Romance', 'director': 'Adam Shankman', 'writer': 'Tina Gordon (screenplay by), Peter Huyck (screenplay by), Alex Gregory (screenplay by), Jas Waters (story by), Tina Gordon (story by), Josh Goldsmith (based on "What Women Want" screenplay by), Cathy Yuspa (based on "What Women Want" screenplay by), Josh Goldsmith (based on "What Women Want" story by), Cathy Yuspa (based on "What Women Want" story by), Diane Drake (based on "What Women Want" story by)', 'actors': 'Taraji P. Henson, Kristen Ledlow, Josh Brener, Kellan Lutz', 'plot': "A woman is boxed out by the male sports agents in her profession, but gains an unexpected edge over them when she develops the ability to hear men's thoughts.", 'language': 'English', 'country': 'USA', 'awards': 'N/A', 'poster': 'https://m.media-amazon.com/images/M/MV5BMTYxNjE2NjIwOF5BMl5BanBnXkFtZTgwMjE0MzkxNzM@._V1_SX300.jpg', 'ratings': [{'source': 'Internet Movie Database', 'value': '5.1/10'}, {'source': 'Rotten Tomatoes', 'value': '44%'}, {'source': 'Metacritic', 'value': '49/100'}], 'metascore': '49', 'imdb_rating': '5.1', 'imdb_votes': '14,081', 'imdb_id': 'tt7634968', 'type': 'movie', 'tomato_meter': 'N/A', 'tomato_image': 'N/A', 'tomato_rating': 'N/A', 'tomato_reviews': 'N/A', 'tomato_fresh': 'N/A', 'tomato_rotten': 'N/A', 'tomato_consensus': 'N/A', 'tomato_user_meter': 'N/A', 'tomato_user_rating': 'N/A', 'tomato_user_reviews': 'N/A', 'tomato_url': 'https://www.rottentomatoes.com/m/what_men_want_2019', 'dvd': '07 May 2019', 'box_office': 'N/A', 'production': 'Paramount Pictures', 'website': 'N/A', 'response': 'True'}
{'title': 'Ad Astra', 'year': '2019', 'rated': 'PG-13', 'released': '20 Sep 2019', 'runtime': '123 min', 'genre': 'Adventure, Drama, Mystery, Sci-Fi, Thriller', 'director': 'James Gray', 'writer': 'James Gray, Ethan Gross', 'actors': 'Brad Pitt, Tommy Lee Jones, Ruth Negga, Donald Sutherland', 'plot': 'Astronaut Roy McBride undertakes a mission across an unforgiving solar system to uncover the truth about his missing father and his doomed expedition that now, 30 years later, threatens the universe.', 'language': 'English, Japanese, Russian', 'country': 'USA', 'awards': 'N/A', 'poster': 'https://m.media-amazon.com/images/M/MV5BZTllZTdlOGEtZTBmMi00MGQ5LWFjN2MtOGEyZTliNGY1MzFiXkEyXkFqcGdeQXVyODk4OTc3MTY@._V1_SX300.jpg', 'ratings': [{'source': 'Internet Movie Database', 'value': '7.0/10'}, {'source': 'Rotten Tomatoes', 'value': '84%'}, {'source': 'Metacritic', 'value': '80/100'}], 'metascore': '80', 'imdb_rating': '7.0', 'imdb_votes': '52,852', 'imdb_id': 'tt2935510', 'type': 'movie', 'tomato_meter': 'N/A', 'tomato_image': 'N/A', 'tomato_rating': 'N/A', 'tomato_reviews': 'N/A', 'tomato_fresh': 'N/A', 'tomato_rotten': 'N/A', 'tomato_consensus': 'N/A', 'tomato_user_meter': 'N/A', 'tomato_user_rating': 'N/A', 'tomato_user_reviews': 'N/A', 'tomato_url': 'https://www.rottentomatoes.com/m/ad_astra', 'dvd': 'N/A', 'box_office': 'N/A', 'production': '20th Century Fox', 'website': 'N/A', 'response': 'True'}
{'title': "Isn't It Romantic", 'year': '2019', 'rated': 'PG-13', 'released': '13 Feb 2019', 'runtime': '89 min', 'genre': 'Comedy, Fantasy, Romance', 'director': 'Todd Strauss-Schulson', 'writer': 'Erin Cardillo (screenplay by), Dana Fox (screenplay by), Katie Silberman (screenplay by), Erin Cardillo (story by)', 'actors': 'Rebel Wilson, Liam Hemsworth, Adam Devine, Priyanka Chopra', 'plot': 'A young woman disenchanted with love mysteriously finds herself trapped inside a romantic comedy.', 'language': 'English', 'country': 'USA', 'awards': 'N/A', 'poster': 'https://m.media-amazon.com/images/M/MV5BZGE1NGYxOWItODdmMy00NWNhLTgxZmMtYmVjYmViMGI0NTdmXkEyXkFqcGdeQXVyNzE2MTQyMzM@._V1_SX300.jpg', 'ratings': [{'source': 'Internet Movie Database', 'value': '5.9/10'}, {'source': 'Rotten Tomatoes', 'value': '70%'}, {'source': 'Metacritic', 'value': '60/100'}], 'metascore': '60', 'imdb_rating': '5.9', 'imdb_votes': '49,950', 'imdb_id': 'tt2452244', 'type': 'movie', 'tomato_meter': 'N/A', 'tomato_image': 'N/A', 'tomato_rating': 'N/A', 'tomato_reviews': 'N/A', 'tomato_fresh': 'N/A', 'tomato_rotten': 'N/A', 'tomato_consensus': 'N/A', 'tomato_user_meter': 'N/A', 'tomato_user_rating': 'N/A', 'tomato_user_reviews': 'N/A', 'tomato_url': 'https://www.rottentomatoes.com/m/isnt_it_romantic_2019', 'dvd': '21 May 2019', 'box_office': 'N/A', 'production': 'New Line Cinema', 'website': 'N/A', 'response': 'True'}
{'title': 'Maleficent: Mistress of Evil', 'year': '2019', 'rated': 'PG', 'released': '18 Oct 2019', 'runtime': '119 min', 'genre': 'Adventure, Family, Fantasy', 'director': 'Joachim Rønning', 'writer': 'Linda Woolverton, Charles Perrault (based on "La Belle Au Bois Dormant" written by), Noah Harpster, Micah Fitzerman-Blue', 'actors': 'Angelina Jolie, Elle Fanning, Harris Dickinson, Michelle Pfeiffer', 'plot': 'Maleficent and her goddaughter Aurora begin to question the complex family ties that bind them as they are pulled in different directions by impending nuptials, unexpected allies, and dark new forces at play.', 'language': 'English', 'country': 'USA, UK', 'awards': 'N/A', 'poster': 'https://m.media-amazon.com/images/M/MV5BZjJiYTExOTAtNWU0Yi00NzJjLTkwOTgtOTU2NWM1ZjJmYWVhXkEyXkFqcGdeQXVyMTkxNjUyNQ@@._V1_SX300.jpg', 'ratings': [{'source': 'Internet Movie Database', 'value': '7.0/10'}, {'source': 'Rotten Tomatoes', 'value': '51%'}, {'source': 'Metacritic', 'value': '43/100'}], 'metascore': '43', 'imdb_rating': '7.0', 'imdb_votes': '20,143', 'imdb_id': 'tt4777008', 'type': 'movie', 'tomato_meter': 'N/A', 'tomato_image': 'N/A', 'tomato_rating': 'N/A', 'tomato_reviews': 'N/A', 'tomato_fresh': 'N/A', 'tomato_rotten': 'N/A', 'tomato_consensus': 'N/A', 'tomato_user_meter': 'N/A', 'tomato_user_rating': 'N/A', 'tomato_user_reviews': 'N/A', 'tomato_url': 'https://www.rottentomatoes.com/m/maleficent_2', 'dvd': 'N/A', 'box_office': 'N/A', 'production': 'Walt Disney Pictures', 'website': 'N/A', 'response': 'True'}
{'title': 'Five Feet Apart', 'year': '2019', 'rated': 'PG-13', 'released': '15 Mar 2019', 'runtime': '116 min', 'genre': 'Drama, Romance', 'director': 'Justin Baldoni', 'writer': 'Mikki Daughtry, Tobias Iaconis', 'actors': 'Haley Lu Richardson, Cole Sprouse, Moises Arias, Kimberly Hebert Gregory', 'plot': 'A pair of teenagers with cystic fibrosis meet in a hospital and fall in love, though their disease means they must avoid close physical contact.', 'language': 'English, French', 'country': 'USA', 'awards': 'N/A', 'poster': 'https://m.media-amazon.com/images/M/MV5BNzVmMjJlN2MtNWQ4Ny00Zjc2LWJjYTgtYjJiNGM5MTM1ZTlkXkEyXkFqcGdeQXVyMjM4NTM5NDY@._V1_SX300.jpg', 'ratings': [{'source': 'Internet Movie Database', 'value': '7.2/10'}, {'source': 'Rotten Tomatoes', 'value': '54%'}, {'source': 'Metacritic', 'value': '53/100'}], 'metascore': '53', 'imdb_rating': '7.2', 'imdb_votes': '24,366', 'imdb_id': 'tt6472976', 'type': 'movie', 'tomato_meter': 'N/A', 'tomato_image': 'N/A', 'tomato_rating': 'N/A', 'tomato_reviews': 'N/A', 'tomato_fresh': 'N/A', 'tomato_rotten': 'N/A', 'tomato_consensus': 'N/A', 'tomato_user_meter': 'N/A', 'tomato_user_rating': 'N/A', 'tomato_user_reviews': 'N/A', 'tomato_url': 'https://www.rottentomatoes.com/m/five_feet_apart', 'dvd': '11 Jun 2019', 'box_office': 'N/A', 'production': 'CBS Films', 'website': 'N/A', 'response': 'True'}
{'title': 'Ma', 'year': '2019', 'rated': 'R', 'released': '31 May 2019', 'runtime': '99 min', 'genre': 'Horror, Thriller', 'director': 'Tate Taylor', 'writer': 'Scotty Landes', 'actors': 'Octavia Spencer, Diana Silvers, Juliette Lewis, McKaley Miller', 'plot': "A lonely woman befriends a group of teenagers and decides to let them party at her house. Just when the kids think their luck couldn't get any better, things start happening that make them question the intention of their host.", 'language': 'English', 'country': 'USA, Japan', 'awards': 'N/A', 'poster': 'https://m.media-amazon.com/images/M/MV5BMTA2MjA3ODU0NjBeQTJeQWpwZ15BbWU4MDE3NTQxNDcz._V1_SX300.jpg', 'ratings': [{'source': 'Internet Movie Database', 'value': '5.6/10'}, {'source': 'Rotten Tomatoes', 'value': '54%'}, {'source': 'Metacritic', 'value': '53/100'}], 'metascore': '53', 'imdb_rating': '5.6', 'imdb_votes': '21,882', 'imdb_id': 'tt7958736', 'type': 'movie', 'tomato_meter': 'N/A', 'tomato_image': 'N/A', 'tomato_rating': 'N/A', 'tomato_reviews': 'N/A', 'tomato_fresh': 'N/A', 'tomato_rotten': 'N/A', 'tomato_consensus': 'N/A', 'tomato_user_meter': 'N/A', 'tomato_user_rating': 'N/A', 'tomato_user_reviews': 'N/A', 'tomato_url': 'https://www.rottentomatoes.com/m/ma_2019', 'dvd': '20 Aug 2019', 'box_office': 'N/A', 'production': 'Universal Pictures', 'website': 'N/A', 'response': 'True'}
{'title': 'Wonder Park', 'year': '2019', 'rated': 'PG', 'released': '15 Mar 2019', 'runtime': '85 min', 'genre': 'Animation, Adventure, Comedy, Family, Fantasy', 'director': 'Dylan Brown', 'writer': 'Josh Appelbaum (screenplay by), André Nemec (screenplay by), Robert Gordon (story by), Josh Appelbaum (story by), André Nemec (story by)', 'actors': 'Sofia Mali, Jennifer Garner, Ken Hudson Campbell, Kenan Thompson', 'plot': 'Wonder Park tells the story of an amusement park where the imagination of a wildly creative girl named June comes alive.', 'language': 'English', 'country': 'Spain, USA', 'awards': 'N/A', 'poster': 'https://m.media-amazon.com/images/M/MV5BMjI5MTQ5NzE4Nl5BMl5BanBnXkFtZTgwNTk2MDA5NjM@._V1_SX300.jpg', 'ratings': [{'source': 'Internet Movie Database', 'value': '5.8/10'}, {'source': 'Rotten Tomatoes', 'value': '33%'}, {'source': 'Metacritic', 'value': '45/100'}], 'metascore': '45', 'imdb_rating': '5.8', 'imdb_votes': '6,451', 'imdb_id': 'tt6428676', 'type': 'movie', 'tomato_meter': 'N/A', 'tomato_image': 'N/A', 'tomato_rating': 'N/A', 'tomato_reviews': 'N/A', 'tomato_fresh': 'N/A', 'tomato_rotten': 'N/A', 'tomato_consensus': 'N/A', 'tomato_user_meter': 'N/A', 'tomato_user_rating': 'N/A', 'tomato_user_reviews': 'N/A', 'tomato_url': 'https://www.rottentomatoes.com/m/amusement_park_2018', 'dvd': '18 Jun 2019', 'box_office': 'N/A', 'production': 'Paramount Animation', 'website': 'N/A', 'response': 'True'}
{'title': 'Rambo: Last Blood', 'year': '2019', 'rated': 'R', 'released': '20 Sep 2019', 'runtime': '89 min', 'genre': 'Action, Adventure, Thriller', 'director': 'Adrian Grunberg', 'writer': 'Matthew Cirulnick (screenplay by), Sylvester Stallone (screenplay by), Dan Gordon (story by), Sylvester Stallone (story by), David Morrell (based on the character created by)', 'actors': 'Sylvester Stallone, Paz Vega, Sergio Peris-Mencheta, Adriana Barraza', 'plot': 'Rambo must confront his past and unearth his ruthless combat skills to exact revenge in a final mission.', 'language': 'English, Spanish', 'country': 'USA, Spain, Bulgaria', 'awards': 'N/A', 'poster': 'https://m.media-amazon.com/images/M/MV5BNTAxZWM2OTgtOTQzOC00ZTI5LTgyYjktZTRhYWM4YWQxNWI0XkEyXkFqcGdeQXVyMjMwNDgzNjc@._V1_SX300.jpg', 'ratings': [{'source': 'Internet Movie Database', 'value': '6.7/10'}, {'source': 'Metacritic', 'value': '26/100'}], 'metascore': '26', 'imdb_rating': '6.7', 'imdb_votes': '23,428', 'imdb_id': 'tt1206885', 'type': 'movie', 'tomato_meter': 'N/A', 'tomato_image': 'N/A', 'tomato_rating': 'N/A', 'tomato_reviews': 'N/A', 'tomato_fresh': 'N/A', 'tomato_rotten': 'N/A', 'tomato_consensus': 'N/A', 'tomato_user_meter': 'N/A', 'tomato_user_rating': 'N/A', 'tomato_user_reviews': 'N/A', 'tomato_url': 'http://www.rottentomatoes.com/m/rambo-v/', 'dvd': 'N/A', 'box_office': 'N/A', 'production': 'N/A', 'website': 'N/A', 'response': 'True'}
{'title': "A Dog's Way Home", 'year': '2019', 'rated': 'PG', 'released': '11 Jan 2019', 'runtime': '96 min', 'genre': 'Adventure, Drama, Family', 'director': 'Charles Martin Smith', 'writer': 'W. Bruce Cameron (screenplay by), Cathryn Michon (screenplay by), W. Bruce Cameron (based on the book by)', 'actors': 'Ashley Judd, Jonah Hauer-King, Edward James Olmos, Alexandra Shipp', 'plot': 'A female dog travels four hundred miles in search of her owner throughout a Colorado wilderness.', 'language': 'English', 'country': 'China, USA', 'awards': 'N/A', 'poster': 'https://m.media-amazon.com/images/M/MV5BMTg5MjcwMzY5OV5BMl5BanBnXkFtZTgwMDM0OTI1NjM@._V1_SX300.jpg', 'ratings': [{'source': 'Internet Movie Database', 'value': '6.7/10'}, {'source': 'Rotten Tomatoes', 'value': '60%'}, {'source': 'Metacritic', 'value': '50/100'}], 'metascore': '50', 'imdb_rating': '6.7', 'imdb_votes': '9,814', 'imdb_id': 'tt7616798', 'type': 'movie', 'tomato_meter': 'N/A', 'tomato_image': 'N/A', 'tomato_rating': 'N/A', 'tomato_reviews': 'N/A', 'tomato_fresh': 'N/A', 'tomato_rotten': 'N/A', 'tomato_consensus': 'N/A', 'tomato_user_meter': 'N/A', 'tomato_user_rating': 'N/A', 'tomato_user_reviews': 'N/A', 'tomato_url': 'https://www.rottentomatoes.com/m/a_dogs_way_home', 'dvd': '09 Apr 2019', 'box_office': 'N/A', 'production': 'Columbia Pictures', 'website': 'N/A', 'response': 'True'}
{'title': 'The Angry Birds Movie 2', 'year': '2019', 'rated': 'PG', 'released': '14 Aug 2019', 'runtime': '97 min', 'genre': 'Animation, Adventure, Comedy, Family', 'director': 'Thurop Van Orman, John Rice(co-director)', 'writer': 'Peter Ackerman (screenplay by), Eyal Podell (screenplay by), Jonathon E. Stewart (screenplay by)', 'actors': 'Jason Sudeikis, Josh Gad, Leslie Jones, Bill Hader', 'plot': 'The flightless birds and scheming green pigs take their feud to the next level.', 'language': 'English', 'country': 'Finland, USA', 'awards': 'N/A', 'poster': 'https://m.media-amazon.com/images/M/MV5BYzdkNGJhNzQtMjY1OC00MDI3LTk0ZDUtNzU0MGZiY2YwZGUxXkEyXkFqcGdeQXVyNzMxNjQxMTk@._V1_SX300.jpg', 'ratings': [{'source': 'Internet Movie Database', 'value': '6.4/10'}, {'source': 'Rotten Tomatoes', 'value': '73%'}, {'source': 'Metacritic', 'value': '60/100'}], 'metascore': '60', 'imdb_rating': '6.4', 'imdb_votes': '7,723', 'imdb_id': 'tt6095472', 'type': 'movie', 'tomato_meter': 'N/A', 'tomato_image': 'N/A', 'tomato_rating': 'N/A', 'tomato_reviews': 'N/A', 'tomato_fresh': 'N/A', 'tomato_rotten': 'N/A', 'tomato_consensus': 'N/A', 'tomato_user_meter': 'N/A', 'tomato_user_rating': 'N/A', 'tomato_user_reviews': 'N/A', 'tomato_url': 'https://www.rottentomatoes.com/m/the_angry_birds_movie_2', 'dvd': 'N/A', 'box_office': 'N/A', 'production': 'Columbia Pictures', 'website': 'N/A', 'response': 'True'}
{'title': 'Breakthrough', 'year': '2019', 'rated': 'PG', 'released': '17 Apr 2019', 'runtime': '116 min', 'genre': 'Biography, Drama', 'director': 'Roxann Dawson', 'writer': 'Grant Nieporte (screenplay by), Joyce Smith (based upon the book by)', 'actors': 'Marcel Ruiz, Topher Grace, Sarah Constible, Dennis Haysbert', 'plot': 'When her 14-year-old son drowns in a lake, a faithful mother prays for him to come back from the brink of death and be healed.', 'language': 'English', 'country': 'USA', 'awards': 'N/A', 'poster': 'https://m.media-amazon.com/images/M/MV5BMTU2ODk2ODEzMV5BMl5BanBnXkFtZTgwMzk1OTk4NjM@._V1_SX300.jpg', 'ratings': [{'source': 'Internet Movie Database', 'value': '6.1/10'}, {'source': 'Rotten Tomatoes', 'value': '61%'}, {'source': 'Metacritic', 'value': '46/100'}], 'metascore': '46', 'imdb_rating': '6.1', 'imdb_votes': '4,746', 'imdb_id': 'tt7083526', 'type': 'movie', 'tomato_meter': 'N/A', 'tomato_image': 'N/A', 'tomato_rating': 'N/A', 'tomato_reviews': 'N/A', 'tomato_fresh': 'N/A', 'tomato_rotten': 'N/A', 'tomato_consensus': 'N/A', 'tomato_user_meter': 'N/A', 'tomato_user_rating': 'N/A', 'tomato_user_reviews': 'N/A', 'tomato_url': 'https://www.rottentomatoes.com/m/breakthrough_2019', 'dvd': '02 Jul 2019', 'box_office': 'N/A', 'production': '20th Century Fox', 'website': 'N/A', 'response': 'True'}
{'title': 'Little', 'year': '2019', 'rated': 'PG-13', 'released': '12 Apr 2019', 'runtime': '109 min', 'genre': 'Comedy, Fantasy, Romance', 'director': 'Tina Gordon', 'writer': 'Tracy Oliver, Tina Gordon, Tracy Oliver (story by)', 'actors': 'Regina Hall, Issa Rae, Marsai Martin, Justin Hartley', 'plot': 'A woman is transformed into her younger self at a point in her life when the pressures of adulthood become too much to bear.', 'language': 'English', 'country': 'USA', 'awards': 'N/A', 'poster': 'https://m.media-amazon.com/images/M/MV5BMTU2NDYwNzkzMV5BMl5BanBnXkFtZTgwNjAyMjMxNzM@._V1_SX300.jpg', 'ratings': [{'source': 'Internet Movie Database', 'value': '5.4/10'}, {'source': 'Rotten Tomatoes', 'value': '47%'}, {'source': 'Metacritic', 'value': '49/100'}], 'metascore': '49', 'imdb_rating': '5.4', 'imdb_votes': '6,541', 'imdb_id': 'tt8085790', 'type': 'movie', 'tomato_meter': 'N/A', 'tomato_image': 'N/A', 'tomato_rating': 'N/A', 'tomato_reviews': 'N/A', 'tomato_fresh': 'N/A', 'tomato_rotten': 'N/A', 'tomato_consensus': 'N/A', 'tomato_user_meter': 'N/A', 'tomato_user_rating': 'N/A', 'tomato_user_reviews': 'N/A', 'tomato_url': 'https://www.rottentomatoes.com/m/little_2019', 'dvd': '25 Jun 2019', 'box_office': 'N/A', 'production': 'Universal Pictures', 'website': 'N/A', 'response': 'True'}
{'title': 'Gemini Man', 'year': '2019', 'rated': 'PG-13', 'released': '11 Oct 2019', 'runtime': '117 min', 'genre': 'Action, Drama, Sci-Fi, Thriller', 'director': 'Ang Lee', 'writer': 'David Benioff (screenplay), Billy Ray (screenplay), Darren Lemke (screenplay), Darren Lemke (story), David Benioff (story)', 'actors': 'Will Smith, Mary Elizabeth Winstead, Clive Owen, Benedict Wong', 'plot': 'An over-the-hill hitman faces off against a younger clone of himself.', 'language': 'English', 'country': 'USA, China', 'awards': 'N/A', 'poster': 'https://m.media-amazon.com/images/M/MV5BNjI5OTNkMzUtZDYzYy00NWQ5LTg4YzYtZmZjZDI0MGQzNGY2XkEyXkFqcGdeQXVyNjg2NjQwMDQ@._V1_SX300.jpg', 'ratings': [{'source': 'Internet Movie Database', 'value': '5.7/10'}, {'source': 'Rotten Tomatoes', 'value': '25%'}, {'source': 'Metacritic', 'value': '38/100'}], 'metascore': '38', 'imdb_rating': '5.7', 'imdb_votes': '17,842', 'imdb_id': 'tt1025100', 'type': 'movie', 'tomato_meter': 'N/A', 'tomato_image': 'N/A', 'tomato_rating': 'N/A', 'tomato_reviews': 'N/A', 'tomato_fresh': 'N/A', 'tomato_rotten': 'N/A', 'tomato_consensus': 'N/A', 'tomato_user_meter': 'N/A', 'tomato_user_rating': 'N/A', 'tomato_user_reviews': 'N/A', 'tomato_url': 'https://www.rottentomatoes.com/m/gemini_man_2019', 'dvd': 'N/A', 'box_office': 'N/A', 'production': 'Paramount Pictures', 'website': 'N/A', 'response': 'True'}
