{'title': 'Glass', 'year': '2019', 'rated': 'PG-13', 'released': '18 Jan 2019', 'runtime': '129 min', 'genre': 'Drama, Sci-Fi, Thriller', 'director': 'M. Night Shyamalan', 'writer': 'M. Night Shyamalan', 'actors': 'James McAvoy, Bruce Willis, Samuel L. Jackson, Anya Taylor-Joy', 'plot': 'Security guard David Dunn uses his supernatural abilities to track Kevin Wendell Crumb, a disturbed man who has twenty-four personalities.', 'language': 'English, Spanish', 'country': 'USA, China', 'awards': 'N/A', 'poster': 'https://m.media-amazon.com/images/M/MV5BMTY1OTA2MjI5OV5BMl5BanBnXkFtZTgwNzkxMjU4NjM@._V1_SX300.jpg', 'ratings': [{'source': 'Internet Movie Database', 'value': '6.7/10'}, {'source': 'Rotten Tomatoes', 'value': '37%'}, {'source': 'Metacritic', 'value': '43/100'}], 'metascore': '43', 'imdb_rating': '6.7', 'imdb_votes': '166,273', 'imdb_id': 'tt6823368', 'type': 'movie', 'tomato_meter': 'N/A', 'tomato_image': 'N/A', 'tomato_rating': 'N/A', 'tomato_reviews': 'N/A', 'tomato_fresh': 'N/A', 'tomato_rotten': 'N/A', 'tomato_consensus': 'N/A', 'tomato_user_meter': 'N/A', 'tomato_user_rating': 'N/A', 'tomato_user_reviews': 'N/A', 'tomato_url': 'https://www.rottentomatoes.com/m/glass_2019', 'dvd': '16 Apr 2019', 'box_office': 'N/A', 'production': 'Universal Pictures', 'website': 'N/A', 'response': 'True'}
{'title': 'Godzilla: King of the Monsters', 'year': '2019', 'rated': 'PG-13', 'released': '31 May 2019', 'runtime': '132 min', 'genre': 'Action, Adventure, Fantasy, Sci-Fi', 'director': 'Michael Dougherty', 'writer': 'Michael Dougherty (screenplay by), Zach Shields (screenplay by), Max Borenstein (story by), Michael Dougherty (story by), Zach Shields (story by)', 'actors': 'Kyle Chandler, Vera Farmiga, Millie Bobby Brown, Ken Watanabe', 'plot': 'The crypto-zoological agency Monarch faces off against a battery of god-sized monsters, including the mighty Godzilla, who collides with Mothra, Rodan, and his ultimate nemesis, the three-headed King Ghidorah.', 'language': 'English, Japanese, Chinese, Spanish', 'country': 'Japan, Canada, USA', 'awards': 'N/A', 'poster': 'https://m.media-amazon.com/images/M/MV5BOGFjYWNkMTMtMTg1ZC00Y2I4LTg0ZTYtN2ZlMzI4MGQwNzg4XkEyXkFqcGdeQXVyMTkxNjUyNQ@@._V1_SX300.jpg', 'ratings': [{'source': 'Internet Movie Database', 'value': '6.1/10'}, {'source': 'Rotten Tomatoes', 'value': '41%'}, {'source': 'Metacritic', 'value': '48/100'}], 'metascore': '48', 'imdb_rating': '6.1', 'imdb_votes': '96,160', 'imdb_id': 'tt3741700', 'type': 'movie', 'tomato_meter': 'N/A', 'tomato_image': 'N/A', 'tomato_rating': 'N/A', 'tomato_reviews': 'N/A', 'tomato_fresh': 'N/A', 'tomato_rotten': 'N/A', 'tomato_consensus': 'N/A', 'tomato_user_meter': 'N/A', 'tomato_user_rating': 'N/A', 'tomato_user_reviews': 'N/A', 'tomato_url': 'http://www.rottentomatoes.com/m/godzilla_2/', 'dvd': '06 Aug 2019', 'box_office': 'N/A', 'production': 'Warner Bros. Pictures', 'website': 'N/A', 'response': 'True'}
{'title': 'The Upside', 'year': '2017', 'rated': 'PG-13', 'released': '11 Jan 2019', 'runtime': '126 min', 'genre': 'Comedy, Drama', 'director': 'Neil Burger', 'writer': 'Jon Hartmere (screenplay by), Éric Toledano (based on the motion picture "Intouchables" by), Olivier Nakache (based on the motion picture "Intouchables" by)', 'actors': 'Kevin Hart, Bryan Cranston, Nicole Kidman, Aja Naomi King', 'plot': "A comedic look at the relationship between a wealthy man with quadriplegia and an unemployed man with a criminal record who's hired to help him.", 'language': 'English, German, Italian', 'country': 'USA', 'awards': '2 wins.', 'poster': 'https://m.media-amazon.com/images/M/MV5BNzY3NzYyNjI0N15BMl5BanBnXkFtZTgwNjYzMDc0NjM@._V1_SX300.jpg', 'ratings': [{'source': 'Internet Movie Database', 'value': '6.8/10'}, {'source': 'Metacritic', 'value': '46/100'}], 'metascore': '46', 'imdb_rating': '6.8', 'imdb_votes': '33,424', 'imdb_id': 'tt1987680', 'type': 'movie', 'tomato_meter': 'N/A', 'tomato_image': 'N/A', 'tomato_rating': 'N/A', 'tomato_reviews': 'N/A', 'tomato_fresh': 'N/A', 'tomato_rotten': 'N/A', 'tomato_consensus': 'N/A', 'tomato_user_meter': 'N/A', 'tomato_user_rating': 'N/A', 'tomato_user_reviews': 'N/A', 'tomato_url': 'https://www.rottentomatoes.com/m/untouchables_2018', 'dvd': 'N/A', 'box_office': 'N/A', 'production': 'N/A', 'website': 'N/A', 'response': 'True'}
{'title': 'The Lego Movie 2: The Second Part', 'year': '2019', 'rated': 'PG', 'released': '08 Feb 2019', 'runtime': '107 min', 'genre': 'Animation, Action, Adventure, Comedy, Family, Fantasy, Musical', 'director': 'Mike Mitchell', 'writer': 'Phil Lord (screenplay by), Christopher Miller (screenplay by), Phil Lord (story by), Christopher Miller (story by), Matthew Fogel (story by), Jerry Siegel (created by: Superman), Joe Shuster (created by: Superman), Bob Kane (created by: Batman), Bill Finger (created by: Batman), William Moulton Marston (created by: Wonder Woman)', 'actors': 'Chris Pratt, Elizabeth Banks, Will Arnett, Tiffany Haddish', 'plot': "It's been five years since everything was awesome and the citizens are facing a huge new threat: Lego Duplo invaders from outer space, wrecking everything faster than they can rebuild.", 'language': 'English', 'country': 'Denmark, Norway, Australia, USA', 'awards': 'N/A', 'poster': 'https://m.media-amazon.com/images/M/MV5BMTkyOTkwNDc1N15BMl5BanBnXkFtZTgwNzkyMzk3NjM@._V1_SX300.jpg', 'ratings': [{'source': 'Internet Movie Database', 'value': '6.7/10'}, {'source': 'Rotten Tomatoes', 'value': '85%'}, {'source': 'Metacritic', 'value': '65/100'}], 'metascore': '65', 'imdb_rating': '6.7', 'imdb_votes': '40,089', 'imdb_id': 'tt3513498', 'type': 'movie', 'tomato_meter': 'N/A', 'tomato_image': 'N/A', 'tomato_rating': 'N/A', 'tomato_reviews': 'N/A', 'tomato_fresh': 'N/A', 'tomato_rotten': 'N/A', 'tomato_consensus': 'N/A', 'tomato_user_meter': 'N/A', 'tomato_user_rating': 'N/A', 'tomato_user_reviews': 'N/A', 'tomato_url': 'http://www.rottentomatoes.com/m/the_lego_movie_2/', 'dvd': '07 May 2019', 'box_office': 'N/A', 'production': 'Warner Bros. Pictures', 'website': 'N/A', 'response': 'True'}
{'title': 'Hustlers', 'year': '2019', 'rated': 'R', 'released': '13 Sep 2019', 'runtime': '110 min', 'genre': 'Comedy, Crime, Drama, Thriller', 'director': 'Lorene Scafaria', 'writer': 'Jessica Pressler (magazine article), Lorene Scafaria (screenplay)', 'actors': 'Constance Wu, Jennifer Lopez, Julia Stiles, Mette Towley', 'plot': 'Inspired by the viral New York Magazine article, Hustlers follows a crew of savvy former strip club employees who band together to turn the tables on their Wall Street clients.', 'language': 'English, Spanish, Russian', 'country': 'USA', 'awards': 'N/A', 'poster': 'https://m.media-amazon.com/images/M/MV5BNjM5ZTNiNGMtMDA2OC00MDYyLWEyNzAtOWZmMzFlY2VmOWM4XkEyXkFqcGdeQXVyMTkxNjUyNQ@@._V1_SX300.jpg', 'ratings': [{'source': 'Internet Movie Database', 'value': '6.6/10'}, {'source': 'Rotten Tomatoes', 'value': '88%'}, {'source': 'Metacritic', 'value': '79/100'}], 'metascore': '79', 'imdb_rating': '6.6', 'imdb_votes': '18,600', 'imdb_id': 'tt5503686', 'type': 'movie', 'tomato_meter': 'N/A', 'tomato_image': 'N/A', 'tomato_rating': 'N/A', 'tomato_reviews': 'N/A', 'tomato_fresh': 'N/A', 'tomato_rotten': 'N/A', 'tomato_consensus': 'N/A', 'tomato_user_meter': 'N/A', 'tomato_user_rating': 'N/A', 'tomato_user_reviews': 'N/A', 'tomato_url': 'https://www.rottentomatoes.com/m/hustlers_2019', 'dvd': 'N/A', 'box_office': 'N/A', 'production': 'STXfilms', 'website': 'N/A', 'response': 'True'}
{'title': 'Rocketman', 'year': '2019', 'rated': 'R', 'released': '31 May 2019', 'runtime': '121 min', 'genre': 'Biography, Drama, Music, Musical', 'director': 'Dexter Fletcher', 'writer': 'Lee Hall', 'actors': 'Taron Egerton, Jamie Bell, Richard Madden, Bryce Dallas Howard', 'plot': "A musical fantasy about the fantastical human story of Elton John's breakthrough years.", 'language': 'English', 'country': 'UK, USA, Canada', 'awards': 'N/A', 'poster': 'https://m.media-amazon.com/images/M/MV5BYTJmMzc0YTctYmQzOS00YWJjLTgzMmEtYjE1NzA1N2QyYzE3XkEyXkFqcGdeQXVyNjg3MDMxNzU@._V1_SX300.jpg', 'ratings': [{'source': 'Internet Movie Database', 'value': '7.4/10'}, {'source': 'Metacritic', 'value': '69/100'}], 'metascore': '69', 'imdb_rating': '7.4', 'imdb_votes': '76,643', 'imdb_id': 'tt2066051', 'type': 'movie', 'tomato_meter': 'N/A', 'tomato_image': 'N/A', 'tomato_rating': 'N/A', 'tomato_reviews': 'N/A', 'tomato_fresh': 'N/A', 'tomato_rotten': 'N/A', 'tomato_consensus': 'N/A', 'tomato_user_meter': 'N/A', 'tomato_user_rating': 'N/A', 'tomato_user_reviews': 'N/A', 'tomato_url': 'http://www.rottentomatoes.com/m/rocketman_2015/', 'dvd': 'N/A', 'box_office': 'N/A', 'production': 'Rocket Pictures', 'website': 'N/A', 'response': 'True'}
{'title': 'Downton Abbey', 'year': '2019', 'rated': 'PG', 'released': '20 Sep 2019', 'runtime': '122 min', 'genre': 'Drama, Romance', 'director': 'Michael Engler', 'writer': 'Julian Fellowes (characters), Julian Fellowes (screenplay by)', 'actors': 'Matthew Goode, Tuppence Middleton, Maggie Smith, Michelle Dockery', 'plot': 'The continuing story of the Crawley family, wealthy owners of a large estate in the English countryside in the early 20th century.', 'language': 'English', 'country': 'UK', 'awards': 'N/A', 'poster': 'https://m.media-amazon.com/images/M/MV5BMmQxNGRkMjYtZTAyMy00MDUyLThiNmYtODI1NTkyNmI0ZTNlXkEyXkFqcGdeQXVyMjM4NTM5NDY@._V1_SX300.jpg', 'ratings': [{'source': 'Internet Movie Database', 'value': '7.7/10'}, {'source': 'Rotten Tomatoes', 'value': '85%'}, {'source': 'Metacritic', 'value': '64/100'}], 'metascore': '64', 'imdb_rating': '7.7', 'imdb_votes': '14,748', 'imdb_id': 'tt6398184', 'type': 'movie', 'tomato_meter': 'N/A', 'tomato_image': 'N/A', 'tomato_rating': 'N/A', 'tomato_reviews': 'N/A', 'tomato_fresh': 'N/A', 'tomato_rotten': 'N/A', 'tomato_consensus': 'N/A', 'tomato_user_meter': 'N/A', 'tomato_user_rating': 'N/A', 'tomato_user_reviews': 'N/A', 'tomato_url': 'https://www.rottentomatoes.com/m/downton_abbey', 'dvd': 'N/A', 'box_office': 'N/A', 'production': 'Focus Features', 'website': 'N/A', 'response': 'True'}
{'title': 'Alita: Battle Angel', 'year': '2019', 'rated': 'PG-13', 'released': '14 Feb 2019', 'runtime': '122 min', 'genre': 'Action, Adventure, Sci-Fi, Thriller', 'director': 'Robert Rodriguez', 'writer': 'James Cameron (screenplay by), Laeta Kalogridis (screenplay by), Yukito Kishiro (based on the graphic novel series "Gunnm" by)', 'actors': 'Rosa Salazar, Christoph Waltz, Jennifer Connelly, Mahershala Ali', 'plot': 'A deactivated cyborg is revived, but cannot remember anything of her past life and goes on a quest to find out who she is.', 'language': 'English, Spanish', 'country': 'USA', 'awards': 'N/A', 'poster': 'https://m.media-amazon.com/images/M/MV5BNzVhMjcxYjYtOTVhOS00MzQ1LWFiNTAtZmY2ZmJjNjIxMjllXkEyXkFqcGdeQXVyNTc5OTMwOTQ@._V1_SX300.jpg', 'ratings': [{'source': 'Internet Movie Database', 'value': '7.4/10'}, {'source': 'Rotten Tomatoes', 'value': '61%'}, {'source': 'Metacritic', 'value': '53/100'}], 'metascore': '53', 'imdb_rating': '7.4', 'imdb_votes': '169,629', 'imdb_id': 'tt0437086', 'type': 'movie', 'tomato_meter': 'N/A', 'tomato_image': 'N/A', 'tomato_rating': 'N/A', 'tomato_reviews': 'N/A', 'tomato_fresh': 'N/A', 'tomato_rotten': 'N/A', 'tomato_consensus': 'N/A', 'tomato_user_meter': 'N/A', 'tomato_user_rating': 'N/A', 'tomato_user_reviews': 'N/A', 'tomato_url': 'https://www.rottentomatoes.com/m/alita_battle_angel', 'dvd': '09 Jul 2019', 'box_office': 'N/A', 'production': '20th Century Fox', 'website': 'N/A', 'response': 'True'}
{'title': 'Good Boys', 'year': '2019', 'rated': 'R', 'released': '16 Aug 2019', 'runtime': '90 min', 'genre': 'Adventure, Comedy', 'director': 'Gene Stupnitsky', 'writer': 'Lee Eisenberg, Gene Stupnitsky', 'actors': 'Jacob Tremblay, Keith L. Williams, Brady Noon, Molly Gordon', 'plot': 'Three 6th grade boys ditch school and embark on an epic journey while carrying accidentally stolen drugs, being hunted by teenage girls, and trying to make their way home in time for a long-awaited party.', 'language': 'English', 'country': 'USA', 'awards': 'N/A', 'poster': 'https://m.media-amazon.com/images/M/MV5BMTc1NjIzODAxMF5BMl5BanBnXkFtZTgwMTgzNzk1NzM@._V1_SX300.jpg', 'ratings': [{'source': 'Internet Movie Database', 'value': '6.8/10'}, {'source': 'Rotten Tomatoes', 'value': '79%'}, {'source': 'Metacritic', 'value': '60/100'}], 'metascore': '60', 'imdb_rating': '6.8', 'imdb_votes': '20,748', 'imdb_id': 'tt7343762', 'type': 'movie', 'tomato_meter': 'N/A', 'tomato_image': 'N/A', 'tomato_rating': 'N/A', 'tomato_reviews': 'N/A', 'tomato_fresh': 'N/A', 'tomato_rotten': 'N/A', 'tomato_consensus': 'N/A', 'tomato_user_meter': 'N/A', 'tomato_user_rating': 'N/A', 'tomato_user_reviews': 'N/A', 'tomato_url': 'https://www.rottentomatoes.com/m/good_boys_2019', 'dvd': 'N/A', 'box_office': 'N/A', 'production': 'Universal Pictures', 'website': 'N/A', 'response': 'True'}
{'title': 'Men in Black: International', 'year': '2019', 'rated': 'PG-13', 'released': '14 Jun 2019', 'runtime': '114 min', 'genre': 'Action, Adventure, Comedy, Sci-Fi', 'director': 'F. Gary Gray', 'writer': 'Matt Holloway, Art Marcum, Lowell Cunningham (characters)', 'actors': 'Chris Hemsworth, Tessa Thompson, Kumail Nanjiani, Rebecca Ferguson', 'plot': 'The Men in Black have always protected the Earth from the scum of the universe. In this new adventure, they tackle their biggest threat to date: a mole in the Men in Black organization.', 'language': 'English, French', 'country': 'USA', 'awards': 'N/A', 'poster': 'https://m.media-amazon.com/images/M/MV5BMDZkODI2ZGItYTY5Yi00MTA4LWExY2ItM2ZmNjczYjM0NDg1XkEyXkFqcGdeQXVyMzY0MTE3NzU@._V1_SX300.jpg', 'ratings': [{'source': 'Internet Movie Database', 'value': '5.6/10'}, {'source': 'Rotten Tomatoes', 'value': '23%'}, {'source': 'Metacritic', 'value': '38/100'}], 'metascore': '38', 'imdb_rating': '5.6', 'imdb_votes': '70,333', 'imdb_id': 'tt2283336', 'type': 'movie', 'tomato_meter': 'N/A', 'tomato_image': 'N/A', 'tomato_rating': 'N/A', 'tomato_reviews': 'N/A', 'tomato_fresh': 'N/A', 'tomato_rotten': 'N/A', 'tomato_consensus': 'N/A', 'tomato_user_meter': 'N/A', 'tomato_user_rating': 'N/A', 'tomato_user_reviews': 'N/A', 'tomato_url': 'https://www.rottentomatoes.com/m/men_in_black_international', 'dvd': '20 Aug 2019', 'box_office': 'N/A', 'production': 'Columbia Pictures', 'website': 'N/A', 'response': 'True'}
{'title': 'Annabelle Comes Home', 'year': '2019', 'rated': 'R', 'released': '26 Jun 2019', 'runtime': '106 min', 'genre': 'Horror, Mystery, Thriller', 'director': 'Gary Dauberman', 'writer': 'James Wan (story by), Gary Dauberman (screenplay by)', 'actors': 'Vera Farmiga, Patrick Wilson, Mckenna Grace, Madison Iseman', 'plot': 'While babysitting the daughter of Ed and Lorraine Warren, a teenager and her friend unknowingly awaken an evil spirit trapped in a doll.', 'language': 'English', 'country': 'USA', 'awards': 'N/A', 'poster': 'https://m.media-amazon.com/images/M/MV5BYmI4NDNiMmQtZTFkYi00ZDVmLThlYTAtMWJlMjU1M2I2ZmViXkEyXkFqcGdeQXVyNjg2NjQwMDQ@._V1_SX300.jpg', 'ratings': [{'source': 'Internet Movie Database', 'value': '6.0/10'}, {'source': 'Rotten Tomatoes', 'value': '65%'}, {'source': 'Metacritic', 'value': '53/100'}], 'metascore': '53', 'imdb_rating': '6.0', 'imdb_votes': '37,499', 'imdb_id': 'tt8350360', 'type': 'movie', 'tomato_meter': 'N/A', 'tomato_image': 'N/A', 'tomato_rating': 'N/A', 'tomato_reviews': 'N/A', 'tomato_fresh': 'N/A', 'tomato_rotten': 'N/A', 'tomato_consensus': 'N/A', 'tomato_user_meter': 'N/A', 'tomato_user_rating': 'N/A', 'tomato_user_reviews': 'N/A', 'tomato_url': 'https://www.rottentomatoes.com/m/untitled_annabelle_film', 'dvd': '17 Sep 2019', 'box_office': 'N/A', 'production': 'New Line Cinema', 'website': 'N/A', 'response': 'True'}
{'title': 'Yesterday', 'year': '2019', 'rated': 'PG-13', 'released': '28 Jun 2019', 'runtime': '116 min', 'genre': 'Comedy, Fantasy, Music, Musical, Romance', 'director': 'Danny Boyle', 'writer': 'Jack Barth (story by), Richard Curtis (screenplay), Richard Curtis (story by)', 'actors': 'Himesh Patel, Lily James, Sophia Di Martino, Ellise Chappell', 'plot': "A struggling musician realizes he's the only person on Earth who can remember The Beatles after waking up in an alternate timeline where they never existed.", 'language': 'English, Italian, Japanese', 'country': 'UK, Russia, China', 'awards': 'N/A', 'poster': 'https://m.media-amazon.com/images/M/MV5BMjQ0NTI0NjkyN15BMl5BanBnXkFtZTgwNzY0MTE0NzM@._V1_SX300.jpg', 'ratings': [{'source': 'Internet Movie Database', 'value': '6.9/10'}, {'source': 'Rotten Tomatoes', 'value': '63%'}, {'source': 'Metacritic', 'value': '56/100'}], 'metascore': '56', 'imdb_rating': '6.9', 'imdb_votes': '57,053', 'imdb_id': 'tt8079248', 'type': 'movie', 'tomato_meter': 'N/A', 'tomato_image': 'N/A', 'tomato_rating': 'N/A', 'tomato_reviews': 'N/A', 'tomato_fresh': 'N/A', 'tomato_rotten': 'N/A', 'tomato_consensus': 'N/A', 'tomato_user_meter': 'N/A', 'tomato_user_rating': 'N/A', 'tomato_user_reviews': 'N/A', 'tomato_url': 'https://www.rottentomatoes.com/m/yesterday_2019', 'dvd': '10 Sep 2019', 'box_office': 'N/A', 'production': 'Universal Pictures', 'website': 'N/A', 'response': 'True'}
{'title': 'A Madea Family Funeral', 'year': '2019', 'rated': 'PG-13', 'released': '01 Mar 2019', 'runtime': '109 min', 'genre': 'Comedy', 'director': 'Tyler Perry', 'writer': 'Tyler Perry', 'actors': 'Tyler Perry, Cassi Davis, Patrice Lovely, Mike Tyson', 'plot': 'A joyous family reunion becomes a hilarious nightmare as Madea and the crew travel to backwoods Georgia, where they find themselves unexpectedly planning a funeral that might unveil unsavory family secrets.', 'language': 'English', 'country': 'USA', 'awards': 'N/A', 'poster': 'https://m.media-amazon.com/images/M/MV5BYTExYTc3YTMtMDY2YS00YTFhLTgwODEtNWQ2MmMzOGZhNTU5XkEyXkFqcGdeQXVyNDExODY2MjU@._V1_SX300.jpg', 'ratings': [{'source': 'Internet Movie Database', 'value': '4.3/10'}, {'source': 'Rotten Tomatoes', 'value': '12%'}, {'source': 'Metacritic', 'value': '39/100'}], 'metascore': '39', 'imdb_rating': '4.3', 'imdb_votes': '2,789', 'imdb_id': 'tt7054636', 'type': 'movie', 'tomato_meter': 'N/A', 'tomato_image': 'N/A', 'tomato_rating': 'N/A', 'tomato_reviews': 'N/A', 'tomato_fresh': 'N/A', 'tomato_rotten': 'N/A', 'tomato_consensus': 'N/A', 'tomato_user_meter': 'N/A', 'tomato_user_rating': 'N/A', 'tomato_user_reviews': 'N/A', 'tomato_url': 'https://www.rottentomatoes.com/m/tyler_perrys_a_madea_family_funeral', 'dvd': '04 Jun 2019', 'box_office': 'N/A', 'production': 'Lionsgate', 'website': 'N/A', 'response': 'True'}
{'title': 'Angel Has Fallen', 'year': '2019', 'rated': 'R', 'released': '23 Aug 2019', 'runtime': '121 min', 'genre': 'Action, Thriller', 'director': 'Ric Roman Waugh', 'writer': 'Robert Mark Kamen (screenplay by), Matt Cook (screenplay by), Ric Roman Waugh (screenplay by), Creighton Rothenberger (story by), Katrin Benedikt (story by), Creighton Rothenberger (based on characters created by), Katrin Benedikt (based on characters created by)', 'actors': 'Gerard Butler, Frederick Schmidt, Danny Huston, Rocci Williams', 'plot': 'Secret Service Agent Mike Banning is framed for the attempted assassination of the President and must evade his own agency and the FBI as he tries to uncover the real threat.', 'language': 'English', 'country': 'USA', 'awards': 'N/A', 'poster': 'https://m.media-amazon.com/images/M/MV5BYmRmMWZhZGItYzA4MC00ZDYyLWE0OTMtYmM0MWRiN2Q4NGU2XkEyXkFqcGdeQXVyMjMxOTE0ODA@._V1_SX300.jpg', 'ratings': [{'source': 'Internet Movie Database', 'value': '6.7/10'}, {'source': 'Rotten Tomatoes', 'value': '39%'}, {'source': 'Metacritic', 'value': '45/100'}], 'metascore': '45', 'imdb_rating': '6.7', 'imdb_votes': '17,303', 'imdb_id': 'tt6189022', 'type': 'movie', 'tomato_meter': 'N/A', 'tomato_image': 'N/A', 'tomato_rating': 'N/A', 'tomato_reviews': 'N/A', 'tomato_fresh': 'N/A', 'tomato_rotten': 'N/A', 'tomato_consensus': 'N/A', 'tomato_user_meter': 'N/A', 'tomato_user_rating': 'N/A', 'tomato_user_reviews': 'N/A', 'tomato_url': 'https://www.rottentomatoes.com/m/angel_has_fallen', 'dvd': 'N/A', 'box_office': 'N/A', 'production': 'Lionsgate', 'website': 'N/A', 'response': 'True'}
{'title': 'Scary Stories to Tell in the Dark', 'year': '2019', 'rated': 'PG-13', 'released': '09 Aug 2019', 'runtime': '108 min', 'genre': 'Horror, Mystery, Thriller', 'director': 'André Øvredal', 'writer': 'Dan Hageman (screenplay by), Kevin Hageman (screenplay by), Guillermo del Toro (screenplay), Marcus Dunstan (story by), Patrick Melton (story by), Alvin Schwartz (novel)', 'actors': 'Zoe Margaret Colletti, Michael Garza, Dean Norris, Gil Bellows', 'plot': 'A group of teens face their fears in order to save their lives.', 'language': 'English', 'country': 'USA, Canada, China', 'awards': 'N/A', 'poster': 'https://m.media-amazon.com/images/M/MV5BNjNiM2E3NDItNGU5NS00N2UwLTk2YWItZWRmMGFlNjJhYzE3XkEyXkFqcGdeQXVyOTQ5MTIwMjM@._V1_SX300.jpg', 'ratings': [{'source': 'Internet Movie Database', 'value': '6.4/10'}, {'source': 'Rotten Tomatoes', 'value': '79%'}, {'source': 'Metacritic', 'value': '61/100'}], 'metascore': '61', 'imdb_rating': '6.4', 'imdb_votes': '18,402', 'imdb_id': 'tt3387520', 'type': 'movie', 'tomato_meter': 'N/A', 'tomato_image': 'N/A', 'tomato_rating': 'N/A', 'tomato_reviews': 'N/A', 'tomato_fresh': 'N/A', 'tomato_rotten': 'N/A', 'tomato_consensus': 'N/A', 'tomato_user_meter': 'N/A', 'tomato_user_rating': 'N/A', 'tomato_user_reviews': 'N/A', 'tomato_url': 'https://www.rottentomatoes.com/m/scary_stories_to_tell_in_the_dark', 'dvd': '22 Oct 2019', 'box_office': 'N/A', 'production': 'CBS Films and Lionsgate', 'website': 'N/A', 'response': 'True'}
{'title': 'Dark Phoenix', 'year': '2019', 'rated': 'PG-13', 'released': '07 Jun 2019', 'runtime': '113 min', 'genre': 'Action, Adventure, Sci-Fi', 'director': 'Simon Kinberg', 'writer': 'Simon Kinberg, Stan Lee (comic book created by), Jack Kirby (comic book created by), Chris Claremont (story "The Dark Phoenix Saga"), John Byrne (story "The Dark Phoenix Saga"), Dave Cockrum (story "The Dark Phoenix Saga")', 'actors': 'James McAvoy, Michael Fassbender, Jennifer Lawrence, Nicholas Hoult', 'plot': 'Jean Grey begins to develop incredible powers that corrupt and turn her into a Dark Phoenix, causing the X-Men to decide if her life is worth more than all of humanity.', 'language': 'English, French', 'country': 'USA, Canada', 'awards': 'N/A', 'poster': 'https://m.media-amazon.com/images/M/MV5BMjAwNDgxNTI0M15BMl5BanBnXkFtZTgwNTY4MDI1NzM@._V1_SX300.jpg', 'ratings': [{'source': 'Internet Movie Database', 'value': '5.8/10'}, {'source': 'Rotten Tomatoes', 'value': '23%'}, {'source': 'Metacritic', 'value': '43/100'}], 'metascore': '43', 'imdb_rating': '5.8', 'imdb_votes': '107,062', 'imdb_id': 'tt6565702', 'type': 'movie', 'tomato_meter': 'N/A', 'tomato_image': 'N/A', 'tomato_rating': 'N/A', 'tomato_reviews': 'N/A', 'tomato_fresh': 'N/A', 'tomato_rotten': 'N/A', 'tomato_consensus': 'N/A', 'tomato_user_meter': 'N/A', 'tomato_user_rating': 'N/A', 'tomato_user_reviews': 'N/A', 'tomato_url': 'https://www.rottentomatoes.com/m/x_men_dark_phoenix', 'dvd': '03 Sep 2019', 'box_office': 'N/A', 'production': '20th Century Fox', 'website': 'N/A', 'response': 'True'}
{'title': 'The Addams Family', 'year': '2019', 'rated': 'PG', 'released': '11 Oct 2019', 'runtime': '87 min', 'genre': 'Animation, Comedy, Family, Fantasy, Horror', 'director': 'Greg Tiernan, Conrad Vernon', 'writer': 'Matt Lieberman (screenplay by), Charles Addams (based on characters created by), Conrad Vernon (story by), Pamela Pettler (screenplay), Matt Lieberman (story), Erica Rivinoja (story by)', 'actors': 'Oscar Isaac, Charlize Theron, Chloë Grace Moretz, Finn Wolfhard', 'plot': "An animated version of Charles Addams' series of cartoons about a peculiar, ghoulish family.", 'language': 'English', 'country': 'UK, Canada, USA', 'awards': 'N/A', 'poster': 'https://m.media-amazon.com/images/M/MV5BODBjOTAzZmMtNGJkOC00M2M3LWI1MTctZjZlMzdiODBkMzc0XkEyXkFqcGdeQXVyMjM4NTM5NDY@._V1_SX300.jpg', 'ratings': [{'source': 'Internet Movie Database', 'value': '5.8/10'}, {'source': 'Rotten Tomatoes', 'value': '41%'}, {'source': 'Metacritic', 'value': '45/100'}], 'metascore': '45', 'imdb_rating': '5.8', 'imdb_votes': '1,513', 'imdb_id': 'tt1620981', 'type': 'movie', 'tomato_meter': 'N/A', 'tomato_image': 'N/A', 'tomato_rating': 'N/A', 'tomato_reviews': 'N/A', 'tomato_fresh': 'N/A', 'tomato_rotten': 'N/A', 'tomato_consensus': 'N/A', 'tomato_user_meter': 'N/A', 'tomato_user_rating': 'N/A', 'tomato_user_reviews': 'N/A', 'tomato_url': 'http://www.rottentomatoes.com/m/the_addams_family/', 'dvd': 'N/A', 'box_office': 'N/A', 'production': 'United Artists Releasing', 'website': 'N/A', 'response': 'True'}
