{'title': 'Hellboy', 'year': '2019', 'rated': 'R', 'released': '12 Apr 2019', 'runtime': '120 min', 'genre': 'Action, Adventure, Fantasy, Horror, Sci-Fi', 'director': 'Neil Marshall', 'writer': 'Andrew Cosby (screenplay by), Mike Mignola (based on the Dark Horse Comic Book "Hellboy" created by)', 'actors': 'Mark Stanley, Brian Gleeson, Nadya Keranova, Maria Tepavicharova', 'plot': 'Based on the graphic novels by Mike Mignola, Hellboy, caught between the worlds of the supernatural and human, battles an ancient sorceress bent on revenge.', 'language': 'English, Spanish, German, Russian', 'country': 'USA, UK, Bulgaria, Canada', 'awards': 'N/A', 'poster': 'https://m.media-amazon.com/images/M/MV5BODdkMDQzMzItZDc4YS00OGM4LTkxNTQtNjUzNzU0ZmJkMWY2XkEyXkFqcGdeQXVyMjMxOTE0ODA@._V1_SX300.jpg', 'ratings': [{'source': 'Internet Movie Database', 'value': '5.2/10'}, {'source': 'Rotten Tomatoes', 'value': '17%'}, {'source': 'Metacritic', 'value': '31/100'}], 'metascore': '31', 'imdb_rating': '5.2', 'imdb_votes': '55,523', 'imdb_id': 'tt2274648', 'type': 'movie', 'tomato_meter': 'N/A', 'tomato_image': 'N/A', 'tomato_rating': 'N/A', 'tomato_reviews': 'N/A', 'tomato_fresh': 'N/A', 'tomato_rotten': 'N/A', 'tomato_consensus': 'N/A', 'tomato_user_meter': 'N/A', 'tomato_user_rating': 'N/A', 'tomato_user_reviews': 'N/A', 'tomato_url': 'https://www.rottentomatoes.com/m/hellboy_2018', 'dvd': '09 Jul 2019', 'box_office': 'N/A', 'production': 'Summit Entertainment', 'website': 'N/A', 'response': 'True'}
{'title': 'Shaft', 'year': '2019', 'rated': 'R', 'released': '14 Jun 2019', 'runtime': '111 min', 'genre': 'Action, Comedy, Crime', 'director': 'Tim Story', 'writer': 'Kenya Barris, Alex Barnow, Ernest Tidyman (based upon the character John Shaft from the novel by)', 'actors': 'Samuel L. Jackson, Jessie T. Usher, Richard Roundtree, Regina Hall', 'plot': "JJ Shaft, a cyber security expert with a degree from MIT, enlists his family's help to uncover the truth behind his best friend's untimely death.", 'language': 'English', 'country': 'USA', 'awards': 'N/A', 'poster': 'https://m.media-amazon.com/images/M/MV5BNmExNGZmYzItZTMzMi00YWJjLWJkYmQtMDg5MjgzYjYyZDk1XkEyXkFqcGdeQXVyNjg3MDMxNzU@._V1_SX300.jpg', 'ratings': [{'source': 'Internet Movie Database', 'value': '6.4/10'}, {'source': 'Rotten Tomatoes', 'value': '32%'}, {'source': 'Metacritic', 'value': '40/100'}], 'metascore': '40', 'imdb_rating': '6.4', 'imdb_votes': '31,372', 'imdb_id': 'tt4463894', 'type': 'movie', 'tomato_meter': 'N/A', 'tomato_image': 'N/A', 'tomato_rating': 'N/A', 'tomato_reviews': 'N/A', 'tomato_fresh': 'N/A', 'tomato_rotten': 'N/A', 'tomato_consensus': 'N/A', 'tomato_user_meter': 'N/A', 'tomato_user_rating': 'N/A', 'tomato_user_reviews': 'N/A', 'tomato_url': 'https://www.rottentomatoes.com/m/shaft_2019', 'dvd': '10 Sep 2019', 'box_office': 'N/A', 'production': 'New Line Cinema', 'website': 'N/A', 'response': 'True'}
{'title': 'The Wizard of Oz', 'year': '1939', 'rated': 'PG', 'released': '25 Aug 1939', 'runtime': '102 min', 'genre': 'Adventure, Family, Fantasy, Musical', 'director': 'Victor Fleming, George Cukor, Mervyn LeRoy, Norman Taurog, Richard Thorpe, King Vidor', 'writer': 'Noel Langley (screenplay), Florence Ryerson (screenplay), Edgar Allan Woolf (screenplay), Noel Langley (adaptation), L. Frank Baum (from the book by)', 'actors': 'Judy Garland, Frank Morgan, Ray Bolger, Bert Lahr', 'plot': 'Dorothy Gale is swept away from a farm in Kansas to a magical land of Oz in a tornado and embarks on a quest with her new friends to see the Wizard who can help her return home to Kansas and help her friends as well.', 'language': 'English', 'country': 'USA', 'awards': 'Won 2 Oscars. Another 7 wins & 14 nominations.', 'poster': 'https://m.media-amazon.com/images/M/MV5BNjUyMTc4MDExMV5BMl5BanBnXkFtZTgwNDg0NDIwMjE@._V1_SX300.jpg', 'ratings': [{'source': 'Internet Movie Database', 'value': '8.0/10'}, {'source': 'Rotten Tomatoes', 'value': '98%'}, {'source': 'Metacritic', 'value': '100/100'}], 'metascore': '100', 'imdb_rating': '8.0', 'imdb_votes': '356,401', 'imdb_id': 'tt0032138', 'type': 'movie', 'tomato_meter': 'N/A', 'tomato_image': 'N/A', 'tomato_rating': 'N/A', 'tomato_reviews': 'N/A', 'tomato_fresh': 'N/A', 'tomato_rotten': 'N/A', 'tomato_consensus': 'N/A', 'tomato_user_meter': 'N/A', 'tomato_user_rating': 'N/A', 'tomato_user_reviews': 'N/A', 'tomato_url': 'http://www.rottentomatoes.com/m/the_wizard_of_oz_1939/', 'dvd': '19 Oct 1999', 'box_office': '$3,840,702', 'production': 'Warner Bros. Pictures', 'website': 'N/A', 'response': 'True'}
{'title': 'UglyDolls', 'year': '2019', 'rated': 'PG', 'released': '03 May 2019', 'runtime': '87 min', 'genre': 'Animation, Adventure, Comedy, Family, Fantasy, Musical', 'director': 'Kelly Asbury', 'writer': 'Alison Peck (screenplay by), Robert Rodriguez (story by), David Horvath (based on the Uglydoll characters by), Sun-min Kim (based on the Uglydoll characters by), Guoqing Liu (additional writing by), Vivian Wang (additional writing by)', 'actors': 'Pitbull, Ice-T, Kelly Clarkson, Blake Shelton', 'plot': 'An animated adventure in which the free-spirited UglyDolls confront what it means to be different, struggle with a desire to be loved, and ultimately discover who you truly are is what matters most.', 'language': 'English', 'country': 'China, Canada, USA', 'awards': 'N/A', 'poster': 'https://m.media-amazon.com/images/M/MV5BMTc0NjE2ODM2OV5BMl5BanBnXkFtZTgwMjQyNDUzNzM@._V1_SX300.jpg', 'ratings': [{'source': 'Internet Movie Database', 'value': '4.8/10'}, {'source': 'Rotten Tomatoes', 'value': '28%'}, {'source': 'Metacritic', 'value': '39/100'}], 'metascore': '39', 'imdb_rating': '4.8', 'imdb_votes': '3,491', 'imdb_id': 'tt1946502', 'type': 'movie', 'tomato_meter': 'N/A', 'tomato_image': 'N/A', 'tomato_rating': 'N/A', 'tomato_reviews': 'N/A', 'tomato_fresh': 'N/A', 'tomato_rotten': 'N/A', 'tomato_consensus': 'N/A', 'tomato_user_meter': 'N/A', 'tomato_user_rating': 'N/A', 'tomato_user_reviews': 'N/A', 'tomato_url': 'https://www.rottentomatoes.com/m/uglydolls', 'dvd': '16 Jul 2019', 'box_office': 'N/A', 'production': 'STXfilms', 'website': 'N/A', 'response': 'True'}
{'title': 'The Peanut Butter Falcon', 'year': '2019', 'rated': 'PG-13', 'released': '23 Aug 2019', 'runtime': '97 min', 'genre': 'Adventure, Comedy, Drama, Sport', 'director': 'Tyler Nilson, Michael Schwartz', 'writer': 'Tyler Nilson, Michael Schwartz', 'actors': 'Shia LaBeouf, Dakota Johnson, Zack Gottsagen, John Hawkes', 'plot': 'Zak runs away from his care home to make his dream of becoming a wrestler come true.', 'language': 'English', 'country': 'USA', 'awards': 'N/A', 'poster': 'https://m.media-amazon.com/images/M/MV5BOWVmZGQ0MGYtMDI1Yy00MDkxLWJiYjQtMmZjZmQ0NDFmMDRhXkEyXkFqcGdeQXVyNjg3MDMxNzU@._V1_SX300.jpg', 'ratings': [{'source': 'Internet Movie Database', 'value': '7.9/10'}, {'source': 'Rotten Tomatoes', 'value': '95%'}, {'source': 'Metacritic', 'value': '70/100'}], 'metascore': '70', 'imdb_rating': '7.9', 'imdb_votes': '7,929', 'imdb_id': 'tt4364194', 'type': 'movie', 'tomato_meter': 'N/A', 'tomato_image': 'N/A', 'tomato_rating': 'N/A', 'tomato_reviews': 'N/A', 'tomato_fresh': 'N/A', 'tomato_rotten': 'N/A', 'tomato_consensus': 'N/A', 'tomato_user_meter': 'N/A', 'tomato_user_rating': 'N/A', 'tomato_user_reviews': 'N/A', 'tomato_url': 'https://www.rottentomatoes.com/m/the_peanut_butter_falcon', 'dvd': 'N/A', 'box_office': 'N/A', 'production': 'Roadside Attractions', 'website': 'N/A', 'response': 'True'}
{'title': 'Unplanned', 'year': '2019', 'rated': 'R', 'released': '29 Mar 2019', 'runtime': '109 min', 'genre': 'Biography, Drama', 'director': 'Chuck Konzelman, Cary Solomon', 'writer': 'Abby Johnson (based on the book "Unplanned" by), Chuck Konzelman (screenplay by), Cary Solomon (screenplay by)', 'actors': 'Ashley Bratcher, Brooks Ryan, Robia Scott, Jared Lotz', 'plot': "All Abby Johnson ever wanted to do was help women. As one of the youngest Planned Parenthood clinic directors in the nation, she believed in a woman's right to choose. Until the day she saw something that changed everything.", 'language': 'English', 'country': 'USA', 'awards': 'N/A', 'poster': 'https://m.media-amazon.com/images/M/MV5BZjBiZjEwNDUtNGIzOS00NTI3LWI5OGMtZDZjMjZhZGNhZDhkXkEyXkFqcGdeQXVyNTQ3MjE4NTU@._V1_SX300.jpg', 'ratings': [{'source': 'Internet Movie Database', 'value': '5.8/10'}, {'source': 'Rotten Tomatoes', 'value': '40%'}, {'source': 'Metacritic', 'value': '10/100'}], 'metascore': '10', 'imdb_rating': '5.8', 'imdb_votes': '10,393', 'imdb_id': 'tt9024106', 'type': 'movie', 'tomato_meter': 'N/A', 'tomato_image': 'N/A', 'tomato_rating': 'N/A', 'tomato_reviews': 'N/A', 'tomato_fresh': 'N/A', 'tomato_rotten': 'N/A', 'tomato_consensus': 'N/A', 'tomato_user_meter': 'N/A', 'tomato_user_rating': 'N/A', 'tomato_user_reviews': 'N/A', 'tomato_url': 'https://www.rottentomatoes.com/m/unplanned', 'dvd': '13 Aug 2019', 'box_office': 'N/A', 'production': 'Pure Flix', 'website': 'N/A', 'response': 'True'}
{'title': 'The Farewell', 'year': '2019', 'rated': 'PG', 'released': '09 Aug 2019', 'runtime': '100 min', 'genre': 'Comedy, Drama', 'director': 'Lulu Wang', 'writer': 'Lulu Wang', 'actors': 'Shuzhen Zhao, Awkwafina, X Mayo, Hong Lu', 'plot': 'A Chinese family discovers their grandmother has only a short while left to live and decide to keep her in the dark, scheduling a wedding to gather before she dies.', 'language': 'Mandarin, English, Japanese, Italian', 'country': 'USA', 'awards': 'N/A', 'poster': 'https://m.media-amazon.com/images/M/MV5BMWE3MjViNWUtY2VjYS00ZDBjLTllMzYtN2FkY2QwYmRiMDhjXkEyXkFqcGdeQXVyODQzNTE3ODc@._V1_SX300.jpg', 'ratings': [{'source': 'Internet Movie Database', 'value': '8.0/10'}, {'source': 'Rotten Tomatoes', 'value': '99%'}, {'source': 'Metacritic', 'value': '89/100'}], 'metascore': '89', 'imdb_rating': '8.0', 'imdb_votes': '9,063', 'imdb_id': 'tt8637428', 'type': 'movie', 'tomato_meter': 'N/A', 'tomato_image': 'N/A', 'tomato_rating': 'N/A', 'tomato_reviews': 'N/A', 'tomato_fresh': 'N/A', 'tomato_rotten': 'N/A', 'tomato_consensus': 'N/A', 'tomato_user_meter': 'N/A', 'tomato_user_rating': 'N/A', 'tomato_user_reviews': 'N/A', 'tomato_url': 'https://www.rottentomatoes.com/m/the_farewell_2018', 'dvd': 'N/A', 'box_office': 'N/A', 'production': 'A24', 'website': 'N/A', 'response': 'True'}
{'title': 'Brightburn', 'year': '2019', 'rated': 'R', 'released': '24 May 2019', 'runtime': '90 min', 'genre': 'Drama, Horror, Mystery, Sci-Fi', 'director': 'David Yarovesky', 'writer': 'Brian Gunn, Mark Gunn', 'actors': 'Elizabeth Banks, David Denman, Jackson A. Dunn, Abraham Clinkscales', 'plot': 'What if a child from another world crash-landed on Earth, but instead of becoming a hero to mankind, he proved to be something far more sinister?', 'language': 'English', 'country': 'USA', 'awards': 'N/A', 'poster': 'https://m.media-amazon.com/images/M/MV5BMjc0YzM2ZjItNzE3OS00NTRhLTkyNTUtMjY5Y2Y5NTU3OWI0XkEyXkFqcGdeQXVyNjU2NTI4MjE@._V1_SX300.jpg', 'ratings': [{'source': 'Internet Movie Database', 'value': '6.2/10'}, {'source': 'Rotten Tomatoes', 'value': '57%'}, {'source': 'Metacritic', 'value': '44/100'}], 'metascore': '44', 'imdb_rating': '6.2', 'imdb_votes': '50,885', 'imdb_id': 'tt7752126', 'type': 'movie', 'tomato_meter': 'N/A', 'tomato_image': 'N/A', 'tomato_rating': 'N/A', 'tomato_reviews': 'N/A', 'tomato_fresh': 'N/A', 'tomato_rotten': 'N/A', 'tomato_consensus': 'N/A', 'tomato_user_meter': 'N/A', 'tomato_user_rating': 'N/A', 'tomato_user_reviews': 'N/A', 'tomato_url': 'https://www.rottentomatoes.com/m/brightburn', 'dvd': '06 Aug 2019', 'box_office': 'N/A', 'production': 'Screen Gems', 'website': 'N/A', 'response': 'True'}
{'title': 'The Kid Who Would Be King', 'year': '2019', 'rated': 'PG', 'released': '25 Jan 2019', 'runtime': '120 min', 'genre': 'Action, Adventure, Family, Fantasy', 'director': 'Joe Cornish', 'writer': 'Joe Cornish', 'actors': 'Louis Ashbourne Serkis, Denise Gough, Dean Chaumoo, Tom Taylor', 'plot': 'A band of kids embark on an epic quest to thwart a medieval menace.', 'language': 'English', 'country': 'UK, USA', 'awards': 'N/A', 'poster': 'https://m.media-amazon.com/images/M/MV5BZjk1ZDE0ZDMtYmIxOC00ZmIwLThiOWQtMDFmYjc5ZjQzYTNlXkEyXkFqcGdeQXVyNjIxMTQ4OTc@._V1_SX300.jpg', 'ratings': [{'source': 'Internet Movie Database', 'value': '6.0/10'}, {'source': 'Rotten Tomatoes', 'value': '89%'}, {'source': 'Metacritic', 'value': '66/100'}], 'metascore': '66', 'imdb_rating': '6.0', 'imdb_votes': '10,619', 'imdb_id': 'tt6811018', 'type': 'movie', 'tomato_meter': 'N/A', 'tomato_image': 'N/A', 'tomato_rating': 'N/A', 'tomato_reviews': 'N/A', 'tomato_fresh': 'N/A', 'tomato_rotten': 'N/A', 'tomato_consensus': 'N/A', 'tomato_user_meter': 'N/A', 'tomato_user_rating': 'N/A', 'tomato_user_reviews': 'N/A', 'tomato_url': 'https://www.rottentomatoes.com/m/the_kid_who_would_be_king', 'dvd': '16 Apr 2019', 'box_office': 'N/A', 'production': '20th Century Fox', 'website': 'N/A', 'response': 'True'}
{'title': 'Missing Link', 'year': '2019', 'rated': 'PG', 'released': '12 Apr 2019', 'runtime': '93 min', 'genre': 'Animation, Adventure, Comedy, Family, Fantasy', 'director': 'Chris Butler', 'writer': 'Chris Butler (screenplay by)', 'actors': 'Hugh Jackman, David Walliams, Stephen Fry, Matt Lucas', 'plot': 'Mr. Link recruits explorer Sir Lionel Frost to help find his long-lost relatives in the fabled valley of Shangri-La. Along with adventurer Adelina Fortnight, this trio of explorers travel the world to help their new friend.', 'language': 'English', 'country': 'USA', 'awards': 'N/A', 'poster': 'https://m.media-amazon.com/images/M/MV5BMWFmNWZmZWYtMWM3OC00YTYyLWIxNDMtOTRjNzhiYWQ0MDIwXkEyXkFqcGdeQXVyODk2NDQ3MTA@._V1_SX300.jpg', 'ratings': [{'source': 'Internet Movie Database', 'value': '6.7/10'}, {'source': 'Rotten Tomatoes', 'value': '89%'}, {'source': 'Metacritic', 'value': '68/100'}], 'metascore': '68', 'imdb_rating': '6.7', 'imdb_votes': '9,149', 'imdb_id': 'tt6348138', 'type': 'movie', 'tomato_meter': 'N/A', 'tomato_image': 'N/A', 'tomato_rating': 'N/A', 'tomato_reviews': 'N/A', 'tomato_fresh': 'N/A', 'tomato_rotten': 'N/A', 'tomato_consensus': 'N/A', 'tomato_user_meter': 'N/A', 'tomato_user_rating': 'N/A', 'tomato_user_reviews': 'N/A', 'tomato_url': 'https://www.rottentomatoes.com/m/missing_link_2019', 'dvd': '09 Jul 2019', 'box_office': 'N/A', 'production': 'Annapurna Pictures', 'website': 'N/A', 'response': 'True'}
{'title': 'Late Night', 'year': '2019', 'rated': 'R', 'released': '14 Jun 2019', 'runtime': '102 min', 'genre': 'Comedy, Drama', 'director': 'Nisha Ganatra', 'writer': 'Mindy Kaling (screenplay by)', 'actors': 'Emma Thompson, Mindy Kaling, John Lithgow, Hugh Dancy', 'plot': 'A late night talk show host suspects that she may soon lose her long-running show.', 'language': 'English', 'country': 'USA', 'awards': 'N/A', 'poster': 'https://m.media-amazon.com/images/M/MV5BNjZmOTEwMGEtOWVmMy00Njg4LWI1OGEtMGYwN2VmYzJiYzAzXkEyXkFqcGdeQXVyODE1MjMyNzI@._V1_SX300.jpg', 'ratings': [{'source': 'Internet Movie Database', 'value': '6.6/10'}, {'source': 'Rotten Tomatoes', 'value': '80%'}, {'source': 'Metacritic', 'value': '70/100'}], 'metascore': '70', 'imdb_rating': '6.6', 'imdb_votes': '10,077', 'imdb_id': 'tt6107548', 'type': 'movie', 'tomato_meter': 'N/A', 'tomato_image': 'N/A', 'tomato_rating': 'N/A', 'tomato_reviews': 'N/A', 'tomato_fresh': 'N/A', 'tomato_rotten': 'N/A', 'tomato_consensus': 'N/A', 'tomato_user_meter': 'N/A', 'tomato_user_rating': 'N/A', 'tomato_user_reviews': 'N/A', 'tomato_url': 'https://www.rottentomatoes.com/m/late_night_2019', 'dvd': '06 Sep 2019', 'box_office': 'N/A', 'production': 'Amazon Studios', 'website': 'N/A', 'response': 'True'}
{'title': 'Miss Bala', 'year': '2019', 'rated': 'PG-13', 'released': '01 Feb 2019', 'runtime': '104 min', 'genre': 'Action, Crime, Drama, Thriller', 'director': 'Catherine Hardwicke', 'writer': 'Gareth Dunnet-Alcocer (screenplay by)', 'actors': 'Gina Rodriguez, Thomas Dekker, Vivian Chan, Barbarella Pardo', 'plot': 'Gloria finds a power she never knew she had when she is drawn into a dangerous world of cross-border crime. Surviving will require all of her cunning, inventiveness, and strength. Based on the Spanish-language film.', 'language': 'English, Spanish', 'country': 'Mexico, USA', 'awards': 'N/A', 'poster': 'https://m.media-amazon.com/images/M/MV5BMTcxNzY3Mzk5OF5BMl5BanBnXkFtZTgwNjQwODU1NjM@._V1_SX300.jpg', 'ratings': [{'source': 'Internet Movie Database', 'value': '5.7/10'}, {'source': 'Rotten Tomatoes', 'value': '22%'}, {'source': 'Metacritic', 'value': '41/100'}], 'metascore': '41', 'imdb_rating': '5.7', 'imdb_votes': '5,347', 'imdb_id': 'tt5941692', 'type': 'movie', 'tomato_meter': 'N/A', 'tomato_image': 'N/A', 'tomato_rating': 'N/A', 'tomato_reviews': 'N/A', 'tomato_fresh': 'N/A', 'tomato_rotten': 'N/A', 'tomato_consensus': 'N/A', 'tomato_user_meter': 'N/A', 'tomato_user_rating': 'N/A', 'tomato_user_reviews': 'N/A', 'tomato_url': 'https://www.rottentomatoes.com/m/miss_bala_2019', 'dvd': '30 Apr 2019', 'box_office': 'N/A', 'production': 'Columbia Pictures', 'website': 'N/A', 'response': 'True'}
{'title': 'The Prodigy', 'year': '2019', 'rated': 'R', 'released': '08 Feb 2019', 'runtime': '92 min', 'genre': 'Horror, Thriller', 'director': 'Nicholas McCarthy', 'writer': 'Jeff Buhler', 'actors': 'Taylor Schilling, Jackson Robert Scott, Peter Mooney, Colm Feore', 'plot': "A mother concerned about her young son's disturbing behavior thinks something supernatural may be affecting him.", 'language': 'English', 'country': 'USA, Canada', 'awards': 'N/A', 'poster': 'https://m.media-amazon.com/images/M/MV5BYTQxNTMwMmUtMWRkYi00MTRmLTgyYWItYTYwNGZkMWZmMzQ2XkEyXkFqcGdeQXVyMjM4NTM5NDY@._V1_SX300.jpg', 'ratings': [{'source': 'Internet Movie Database', 'value': '5.9/10'}, {'source': 'Metacritic', 'value': '45/100'}], 'metascore': '45', 'imdb_rating': '5.9', 'imdb_votes': '16,365', 'imdb_id': 'tt4504044', 'type': 'movie', 'tomato_meter': 'N/A', 'tomato_image': 'N/A', 'tomato_rating': 'N/A', 'tomato_reviews': 'N/A', 'tomato_fresh': 'N/A', 'tomato_rotten': 'N/A', 'tomato_consensus': 'N/A', 'tomato_user_meter': 'N/A', 'tomato_user_rating': 'N/A', 'tomato_user_reviews': 'N/A', 'tomato_url': 'N/A', 'dvd': 'N/A', 'box_office': 'N/A', 'production': 'N/A', 'website': 'N/A', 'response': 'True'}
{'title': 'Poms', 'year': '2019', 'rated': 'PG-13', 'released': '10 May 2019', 'runtime': '90 min', 'genre': 'Comedy, Drama, Sport', 'director': 'Zara Hayes', 'writer': 'Zara Hayes (story by), Shane Atkinson (story by), Shane Atkinson (screenplay by)', 'actors': 'Diane Keaton, Jacki Weaver, Celia Weston, Alisha Boe', 'plot': "POMS is a comedy about a group of women who form a cheer leading squad at their retirement community, proving that you're never too old to 'bring it!'", 'language': 'English', 'country': 'UK, USA', 'awards': 'N/A', 'poster': 'https://m.media-amazon.com/images/M/MV5BMTk0ZmYwZjgtZWEwZi00MWEyLWFkZmItOTUzMmU5Y2Q5YTFjXkEyXkFqcGdeQXVyNDg4NjY5OTQ@._V1_SX300.jpg', 'ratings': [{'source': 'Internet Movie Database', 'value': '5.7/10'}, {'source': 'Rotten Tomatoes', 'value': '34%'}, {'source': 'Metacritic', 'value': '36/100'}], 'metascore': '36', 'imdb_rating': '5.7', 'imdb_votes': '2,124', 'imdb_id': 'tt5125894', 'type': 'movie', 'tomato_meter': 'N/A', 'tomato_image': 'N/A', 'tomato_rating': 'N/A', 'tomato_reviews': 'N/A', 'tomato_fresh': 'N/A', 'tomato_rotten': 'N/A', 'tomato_consensus': 'N/A', 'tomato_user_meter': 'N/A', 'tomato_user_rating': 'N/A', 'tomato_user_reviews': 'N/A', 'tomato_url': 'https://www.rottentomatoes.com/m/poms', 'dvd': '23 Jul 2019', 'box_office': 'N/A', 'production': 'STXfilms', 'website': 'N/A', 'response': 'True'}
{'title': 'The Kitchen', 'year': '2019', 'rated': 'R', 'released': '09 Aug 2019', 'runtime': '102 min', 'genre': 'Action, Crime, Drama', 'director': 'Andrea Berloff', 'writer': 'Ollie Masters (comic book series), Ming Doyle (comic book series), Andrea Berloff', 'actors': 'Melissa McCarthy, Tiffany Haddish, Elisabeth Moss, Domhnall Gleeson', 'plot': "The wives of New York gangsters in Hell's Kitchen in the 1970s continue to operate their husbands' rackets after they're locked up in prison.", 'language': 'English', 'country': 'USA', 'awards': 'N/A', 'poster': 'https://m.media-amazon.com/images/M/MV5BZGEwMWJlNzMtMjQ4YS00YjI4LTkwZTYtMGFiZTY5YmE2ZTIwXkEyXkFqcGdeQXVyMTkxNjUyNQ@@._V1_SX300.jpg', 'ratings': [{'source': 'Internet Movie Database', 'value': '5.1/10'}, {'source': 'Rotten Tomatoes', 'value': '22%'}, {'source': 'Metacritic', 'value': '35/100'}], 'metascore': '35', 'imdb_rating': '5.1', 'imdb_votes': '4,812', 'imdb_id': 'tt5822564', 'type': 'movie', 'tomato_meter': 'N/A', 'tomato_image': 'N/A', 'tomato_rating': 'N/A', 'tomato_reviews': 'N/A', 'tomato_fresh': 'N/A', 'tomato_rotten': 'N/A', 'tomato_consensus': 'N/A', 'tomato_user_meter': 'N/A', 'tomato_user_rating': 'N/A', 'tomato_user_reviews': 'N/A', 'tomato_url': 'https://www.rottentomatoes.com/m/the_kitchen_2019', 'dvd': 'N/A', 'box_office': 'N/A', 'production': 'New Line Cinema', 'website': 'N/A', 'response': 'True'}
{'title': 'After', 'year': '2019', 'rated': 'PG-13', 'released': '12 Apr 2019', 'runtime': '105 min', 'genre': 'Drama, Romance', 'director': 'Jenny Gage', 'writer': 'Tom Betterton (screenplay by), Tamara Chestna (screenplay by), Jenny Gage (screenplay by), Susan McMartin (screenplay by), Anna Todd (novel)', 'actors': 'Josephine Langford, Hero Fiennes Tiffin, Khadijha Red Thunder, Dylan Arnold', 'plot': 'A young woman falls for a guy with a dark secret and the two embark on a rocky relationship. Based on the novel by Anna Todd.', 'language': 'English', 'country': 'USA', 'awards': 'N/A', 'poster': 'https://m.media-amazon.com/images/M/MV5BOGUwMjk3YzktNDI0Yy00MzFiLWFjNmEtYTA2ODVjMzNhODhjXkEyXkFqcGdeQXVyOTQ1MDI4MzY@._V1_SX300.jpg', 'ratings': [{'source': 'Internet Movie Database', 'value': '5.4/10'}, {'source': 'Rotten Tomatoes', 'value': '17%'}, {'source': 'Metacritic', 'value': '30/100'}], 'metascore': '30', 'imdb_rating': '5.4', 'imdb_votes': '20,451', 'imdb_id': 'tt4126476', 'type': 'movie', 'tomato_meter': 'N/A', 'tomato_image': 'N/A', 'tomato_rating': 'N/A', 'tomato_reviews': 'N/A', 'tomato_fresh': 'N/A', 'tomato_rotten': 'N/A', 'tomato_consensus': 'N/A', 'tomato_user_meter': 'N/A', 'tomato_user_rating': 'N/A', 'tomato_user_reviews': 'N/A', 'tomato_url': 'https://www.rottentomatoes.com/m/after_2019', 'dvd': '09 Jul 2019', 'box_office': 'N/A', 'production': 'Aviron Pictures', 'website': 'N/A', 'response': 'True'}
{'title': 'Blinded by the Light', 'year': '2019', 'rated': 'PG-13', 'released': '16 Aug 2019', 'runtime': '118 min', 'genre': 'Comedy, Drama, Music', 'director': 'Gurinder Chadha', 'writer': 'Sarfraz Manzoor (screenplay), Gurinder Chadha (screenplay), Paul Mayeda Berges (screenplay), Sarfraz Manzoor (based on the book "Greetings from Bury Park - Race. Religion. Rock \'N\' Roll." by), Bruce Springsteen (inspired by the words and music of)', 'actors': 'Billy Barratt, Ronak Singh Chadha Berges, Viveik Kalra, Lee Barnett', 'plot': 'In England in 1987, a teenager from an Asian family learns to live his life, understand his family and find his own voice through the music of American rock star Bruce Springsteen.', 'language': 'English', 'country': 'UK, USA', 'awards': 'N/A', 'poster': 'https://m.media-amazon.com/images/M/MV5BZDUzNGYxZDAtZjVjZC00YzI2LTk3MTItNmE3NGQwOWQwZjJiXkEyXkFqcGdeQXVyMjcyMzI2OTQ@._V1_SX300.jpg', 'ratings': [{'source': 'Internet Movie Database', 'value': '6.9/10'}, {'source': 'Rotten Tomatoes', 'value': '89%'}, {'source': 'Metacritic', 'value': '71/100'}], 'metascore': '71', 'imdb_rating': '6.9', 'imdb_votes': '7,989', 'imdb_id': 'tt8266310', 'type': 'movie', 'tomato_meter': 'N/A', 'tomato_image': 'N/A', 'tomato_rating': 'N/A', 'tomato_reviews': 'N/A', 'tomato_fresh': 'N/A', 'tomato_rotten': 'N/A', 'tomato_consensus': 'N/A', 'tomato_user_meter': 'N/A', 'tomato_user_rating': 'N/A', 'tomato_user_reviews': 'N/A', 'tomato_url': 'https://www.rottentomatoes.com/m/blinded_by_the_light_2019', 'dvd': 'N/A', 'box_office': 'N/A', 'production': 'New Line Cinema', 'website': 'N/A', 'response': 'True'}
{'title': 'Greta', 'year': '2018', 'rated': 'R', 'released': '01 Mar 2019', 'runtime': '98 min', 'genre': 'Drama, Mystery, Thriller', 'director': 'Neil Jordan', 'writer': 'Ray Wright (screenplay by), Neil Jordan (screenplay by), Ray Wright (story by)', 'actors': 'Isabelle Huppert, Chloë Grace Moretz, Maika Monroe, Jane Perry', 'plot': "A young woman befriends a lonely widow who's harboring a dark and deadly agenda toward her.", 'language': 'English, Hungarian, French, Korean', 'country': 'Ireland, USA', 'awards': 'N/A', 'poster': 'https://m.media-amazon.com/images/M/MV5BOTg0OTVjYjUtOWUzYS00YjJjLWI3NWItMmVjNTBlMTE2ODJlXkEyXkFqcGdeQXVyMjM4NTM5NDY@._V1_SX300.jpg', 'ratings': [{'source': 'Internet Movie Database', 'value': '6.0/10'}, {'source': 'Metacritic', 'value': '54/100'}], 'metascore': '54', 'imdb_rating': '6.0', 'imdb_votes': '17,013', 'imdb_id': 'tt2639336', 'type': 'movie', 'tomato_meter': 'N/A', 'tomato_image': 'N/A', 'tomato_rating': 'N/A', 'tomato_reviews': 'N/A', 'tomato_fresh': 'N/A', 'tomato_rotten': 'N/A', 'tomato_consensus': 'N/A', 'tomato_user_meter': 'N/A', 'tomato_user_rating': 'N/A', 'tomato_user_reviews': 'N/A', 'tomato_url': 'N/A', 'dvd': 'N/A', 'box_office': 'N/A', 'production': 'N/A', 'website': 'N/A', 'response': 'True'}
